page_id,keyword,annotation,url
1,项目,项目是人们通过努力，运用新的方法，将人力的、材料的和财务的资源组织起来，在给定的费用和时间约束规范内，完成一项独立的、一次性的工作任务，以期达到由数量和质量指标所限定的目标。叶圣陶《倪焕之》二五：“教育这个项目当然是不容轻易忽略的。” 洪深 《戏剧导演的初步知识》上篇二：“它们的式样、大小、制造的材料、使用的方法等等，项目繁多。” 秦牧 《艺海拾贝·核心》：“生动的语言和丰富的词汇，看来该是技巧性很强的一个项目了。”项目参数包括项目范围、质量、成本、时间、资源。美国项目管理协会（project Management Institute，PMI)在其出版的《项目管理知识体系指南》（Project Management Body of Knowledge，PMBOK）中为项目所做的定义是：项目是为创造独特的产品、服务或成果而进行的临时性工作。以下活动都可以称为一个项目：1、开发一项新产品；2、计划举行一项大型活动（如策划组织婚礼、大型国际会议等）；3、策划一次自驾游旅游；4、ERP的咨询、开发、实施与培训。,https://baike.baidu.com/item/%E9%A1%B9%E7%9B%AE/477803
1,机理,机理是指为实现某一特定功能，一定的系统结构中各要素的内在工作方式以及诸要素在一定环境条件下相互联系、相互作用的运行规则和原理。对机理有两种解释：一是机理指为实现某一特定功能，一定的系统结构中各要素的内在工作方式以及诸要素在一定环境下相互联系、相互作用的运行规则和原理；二是指事物变化的理由和道理，从机理的概念分析，机理包括形成要素和形成要素之间的关系两个方面。化学动力学中，“机理”是指从原子的结合关系中来描绘化学过程。如果其过程是动力学控制的，机理是指原子水平的表面过程。,https://baike.baidu.com/item/%E6%9C%BA%E7%90%86/3815469
1,公安大学,中国人民公安大学（People's Public Security University of China），简称公安大学，位于北京市，是公安部直属普通高等学校暨公安部高级警官学院，国家“世界一流学科建设高校”、“卓越法律人才教育培养计划”试点高校，是公安行业综合性大学。中国人民公安大学创始于1948年7月，时为中共中央在河北解放区建屏县（今平山县）举办的华北保卫干部训练班。后历经华北公安干部学校、中央公安干部学校、中央人民公安学院、中央政法干部学校和恢复中央人民公安学院等发展阶段。1984年，中央人民公安学院改建为全日制普通高等学校，成立中国人民公安大学。1998年2月，与中国人民警官大学合并，组成新的中国人民公安大学。2000年，交通部北京交通人民警察学校并入学校。截至2018年10月，学校木樨地、团河两个校区占地1200余亩；设有11个学院、13个本科专业及22个专业方向；拥有博士后科研流动站3个，一级学科博士点3个，一级学科硕士点3个、专业学位硕士点5个；拥有一级学科国家重点学科2个，北京市重点学科4个；专任教师600余人，在校生13000多人。[1-2],https://baike.baidu.com/item/公安大学

1,利用,利用，是一个汉语词汇，拼音是lì yòng，意思是利于发挥效用，口语中多指贬义，出自《老子.道德经》：“三十辐共一毂，当其无，有车之用。埏埴以为器，当其无，有器之用。凿户牖以为室，当其无，有室之用。故有之以为利，无之以为用。,https://baike.baidu.com/item/%E5%88%A9%E7%94%A8/882910
1,研究院,研究院，在学术界，称其为科学试验的研究机构。是大学之后的进阶教育研究机构，一般设于大学中，以“某大学某研究生院”的形式存在，也有独立设立者。研究院与研究生院是两个不同的概念，但港澳地区一般将“研究生院”称为“研究院”。,https://baike.baidu.com/item/%E7%A0%94%E7%A9%B6%E9%99%A2/5365502
1,脆弱,脆弱，是一个汉语词语，拼音是cuì ruò，意思是东西易碎易折经受不起挫折，对事物敏感、患得患失；不坚强：感情脆弱、神经脆弱。出自《国语·晋语六》：“德刑不立，奸宄并至，臣脆弱，不能忍俟也。”,https://baike.baidu.com/item/%E8%84%86%E5%BC%B1/49052
1,安全,安全，是一个汉语词语，是指不受威胁，没有危险、危害、损失。当汉语的“安全”一词用来译指英文时，可以与其对应的主要有safety和security两个单词，虽然这两个单词的含义及用法有所不同，但都可在不同意义上与中文“安全”相对应。,https://baike.baidu.com/item/%E5%AE%89%E5%85%A8/32778
1,考古,考古表示古代遗存中（尤其是原始社会）所观察到的共同体。“考古”这一名词，在汉语中出现很早，如北宋时期的学者吕大临就曾著《考古图》（1092年）一书，但当时所谓“考古”，仅限于对一些传世的青铜器和石刻等物的搜集和整理，与近代意义上的考古学含义有很大的区别。12日公布了2015年中国考古六大新发现。包括：江西南昌西汉海昏侯墓，海南东南部沿海地区新石器时代遗址，江苏兴化、东台市蒋庄良渚文化遗址，陕西宝鸡市周原遗址，汉魏洛阳城宫城太极殿遗址和辽宁“丹东一号”清代沉船遗址。,https://baike.baidu.com/item/%E8%80%83%E5%8F%A4/35056
1,劣化,,https://baike.baidu.com/item/%E5%8A%A3%E5%8C%96/8590323
1,预警,预警是指在灾害或灾难以及其他需要提防的危险发生之前，根据以往的总结的规律或观测得到的可能性前兆，向相关部门发出紧急信号，报告危险情况，以避免危害在不知情或准备不足的情况下发生，从而最大程度的减轻危害所造成的损失的行为。,https://baike.baidu.com/item/%E9%A2%84%E8%AD%A6/75122
1,示范,示范，读音为shì fàn，汉语词语，意思是做出榜样或典范,供人们学习；起示范作用；把事物摆出来或指出来使人知道。,https://baike.baidu.com/item/%E7%A4%BA%E8%8C%83/363731
1,研发,研发即研究开发、研究与开发、研究发展，是指各种研究机构、企业或个人为获得科学技术（不包括人文、社会科学）新知识，创造性运用科学技术新知识，或实质性改进技术、产品和服务而持续进行的具有明确目标的系统活动，包括系统及设备的测试，安装，维护，维修等一系列的系统活动。2016年2月，美国国家科学基金会发布的《美国科学与工程指标》显示，中国已成为不容置疑的世界第二研发大国。所了解，全球研发支出总体呈上升趋势，并仍集中在北美、欧洲及东亚和东南亚地区。美国仍然是世界第一研发大国，中国居第二位，中国的研发开支接近欧盟的总和。在按购买力平价计算的全球研发总支出当中，中国约占20%，仅次于美国（27%）；日本居第三位，占10%；德国第四，占6%；接下来是韩国、法国、俄罗斯、英国和印度，他们分别占全球研发支出总额的2%至4%。,https://baike.baidu.com/item/%E7%A0%94%E5%8F%91/4815440
1,技术,世界知识产权组织在1977年版的《供发展中国家使用的许可证贸易手册》中，给技术下的定义：“技术是制造一种产品的系统知识，所采用的一种工艺或提供的一项服务，不论这种知识是否反映在一项发明、一项外形设计、一项实用新型或者一种植物新品种，或者反映在技术情报或技能中，或者反映在专家为设计、安装、开办或维修一个工厂或为管理一个工商业企业或其活动而提供的服务或协助等方面。”这是至今为止国际上给技术所下的最为全面和完整的定义。知识产权组织把世界上所有能带来经济效益的科学知识都定义为技术。,https://baike.baidu.com/item/%E6%8A%80%E6%9C%AF/13014499
1,敦煌研究院,敦煌研究院的前身是1944年成立的国立敦煌艺术研究所，1950年改组为敦煌文物研究所，1984年扩建为敦煌研究院。敦煌研究院是敦煌学研究的科研单位。也是保护敦煌石窟（莫高窟、榆林窟、西千佛洞）和麦积山石窟、炳灵寺石窟、庆阳北石窟寺等其它文物机构的文博单位；是爱国主义教育基地，也是旅游接待单位。常书鸿促成了国立敦煌艺术研究所的成立，他视莫高窟为“家”，被誉为“敦煌守护神”，这5个字就镌刻在常书鸿先生的墓碑上。2017年5月，在庆祝“国际博物馆日”之际，国家一级博物馆授牌仪式近日在北京举行，敦煌研究院成功晋级，成为国家文物局第三批新增的34家国家一级博物馆的其中之一。2019年8月31日，由敦煌研究院等单位联合摄制，赵声良担任学术主持的大型纪录片《莫高窟与吴哥窟的对话》在敦煌国际会展中心首映。该纪录片的首映是第四届丝绸之路(敦煌)国际文化博览会与第九届敦煌行·丝绸之路国际旅行节闭幕式的重要活动之一。,https://baike.baidu.com/item/%E6%95%A6%E7%85%8C%E7%A0%94%E7%A9%B6%E9%99%A2/1719397
1,研究,研究，读音，汉语词语，意思是主动寻求根本性原因与更高可靠性依据，从而为提高事业或功利的可靠性和稳健性而做的工作。,https://baike.baidu.com/item/%E7%A0%94%E7%A9%B6/1883844
1,文化遗产,文化遗产是历史留给人类的宝贵财富。从存在形态上分为物质文化遗产（有形文化遗产）和非物质文化遗产（无形文化遗产）。文化遗产是具有历史、艺术和科学价值的文物；非物质文化遗产是指各种以非物质形态存在的、与群众生活密切相关且世代相承的传统文化。[1-2]2006年起，每年六月的第二个星期六为中国文化遗产日。2017年10月18日习近平同志在十九大报告中指出，要加强文化遗产保护传承。[3-4],https://baike.baidu.com/item/%E6%96%87%E5%8C%96%E9%81%97%E4%BA%A7/749049
1,2020YFC,阎锡新，男，1962年8月出生，中共党员，河北泊头人。河北省新型冠状病毒感染的肺炎救治专家组组长、河北医科大学第二医院呼吸与重症医学一科主任，河北省医学会变态反应分会副主任委员；石家庄市重症专业委员会副主任委员，《国际呼吸杂志》副总编辑；第四届中国医师奖获得者。河北省新冠肺炎医疗救治专家组组长、河北医大二院呼吸与危重医学一科主任。2020年10月23日，被中央文明办、国家卫生健康委员会评为“中国好医生、中国好护士”抗疫特别人物。,https://baike.baidu.com/item/%E9%98%8E%E9%94%A1%E6%96%B0/400306
1,馆藏,馆藏，读guǎncáng，指图书馆、博物馆等收藏的具有文化价值的物品。,https://baike.baidu.com/item/%E9%A6%86%E8%97%8F/11013199
1,保护,保护，指尽力照顾，使自身（或他人、或其他事物）的权益不受损害。语出《书·毕命》“分居里，成 周 郊” 孔 传：“分别民之居里，异其善恶；成定 东周 郊境，使有保护。”,https://baike.baidu.com/item/%E4%BF%9D%E6%8A%A4/33190
1,文物,文物是人类在社会活动中遗留下来的具有历史、艺术、科学价值的遗物和遗迹。它是人类宝贵的历史文化遗产。文物是指具体的物质遗存，它的基本特征是：第一，必须是由人类创造的，或者是与人类活动有关的；第二，必须是已经成为历史的过去，不可能再重新创造的。目前，各个国家对文物的称谓并不一致，其所指涵义和范围也不尽相同，因而迄今尚未形成一个对文物共同确认的统一定义。2017年12月1日，《公共服务领域英文译写规范》正式实施，规定文物标准英文名为Cultural Relic。,https://baike.baidu.com/item/%E6%96%87%E7%89%A9/33145
1,关键技术,亦称“关键动作”。动作技术中至关重要的部分，它是掌握动作技术、提高运动成绩起决定作用的环节。如跳远技术中的起跳。在体育教学与训练中都需要狠抓这个动作关键。,https://baike.baidu.com/item/%E5%85%B3%E9%94%AE%E6%8A%80%E6%9C%AF/5692286
