page_id,keyword,annotation,url
1,申报,《申报》原名《申江新报》，1872年4月30日（清同治十一年三月二十三日）在上海创刊，1949年5月27日停刊。是近代中国发行时间最久、具有广泛社会影响的报纸，是中国现代报纸开端的标志。它前后总计经营了77年，历经晚清、北洋政府、国民政府三个时代，共出版27000余期，出版时间之长，影响之广泛，同时期其它报纸难以企及，在中国新闻史和社会史研究上都占有重要地位，被人称为研究中国近现代史的“百科全书”。,https://baike.baidu.com/item/%E7%94%B3%E6%8A%A5/3577852
1,科学院,中国科学院（英文名称：Chinese Academy of Sciences，简称中科院）成立于1949年11月，为中国自然科学最高学术机构、科学技术最高咨询机构、自然科学与高技术综合研究发展中心。中国科学院提出了建设国家创新体系的构想，先后实施知识创新工程、“创新2020”、《“率先行动”计划暨全面深化改革纲要》，提出了《迎接知识经济时代，建设国家创新体系》、《创新促进发展，科技引领未来》、《创新2050：科学技术与中国的未来》、《科技发展新态势与面向2020年的战略选择》等战略研究报告。据2018年11月中国科学院官网显示，全院共拥有12个分院、100多家科研院所、3所大学（中国科学院大学、中国科学技术大学，与上海市共建上海科技大学）、130多个国家级重点实验室和工程中心、210多个野外观测台站，承担20余项国家重大科技基础设施的建设与运行，正式职工7.1万余人，在学研究生6.4万余人；建成了完整的自然科学学科体系，物理、化学、材料科学、数学、环境与生态学、地球科学等学科整体水平已进入世界先进行列，一些领域方向也具备了进入世界第一方阵的良好态势。在解决关系国家全局和长远发展的重大问题上，已成为不可替代的国家战略科技力量。一批科学家在国家重大科技任务中发挥了关键和中坚作用，并作为我国科技界的代表活跃在国际科技前沿。2019年9月，经党中央批准，十九届中央第四轮巡视将对中国科学院党组织开展常规巡视。,https://baike.baidu.com/item/%E4%B8%AD%E5%9B%BD%E7%A7%91%E5%AD%A6%E9%99%A2/271375
1,中医,中医一般指以中国汉族劳动人民创造的传统医学为主的医学，所以也称汉医。是研究人体生理、病理以及疾病的诊断和防治等的一门学科。中医诞生于原始社会，春秋战国时期中医理论已基本形成，之后历代均有总结发展。除此之外对汉字文化圈国家影响深远，如日本医学、韩国韩医学、朝鲜高丽医学、越南东医学等都是以中医为基础发展起来的。中医承载着中国古代人民同疾病作斗争的经验和理论知识，是在古代朴素的唯物论和自发的辩证法思想指导下，通过长期医疗实践逐步形成并发展成的医学理论体系。中医学以阴阳五行作为理论基础，将人体看成是气、形、神的统一体，通过“望闻问切”四诊合参的方法，探求病因、病性、病位，分析病机及人体内五脏六腑、经络关节、气血津液的变化，判断邪正消长，进而得出病名，归纳出证型，以辨证论治原则，制定“汗、吐、下、和、温、清、补、消”等治法，使用中药、针灸、推拿、按摩、拔罐、气功、食疗等多种治疗手段，使人体达到阴阳调和而康复。2018年10月1日，世界卫生组织首次将中医纳入其具有全球影响力的医学纲要。,https://baike.baidu.com/item/%E4%B8%AD%E5%8C%BB/234039
1,专项,特定的某个项目。例句：～训练。进行～检查。～资金。[1-2],https://baike.baidu.com/item/%E4%B8%93%E9%A1%B9/10927791
1,指南,指南，汉语词语，拼音是zhǐ nán，意思是指导，辨别方向的依据。,https://baike.baidu.com/item/%E6%8C%87%E5%8D%97/10153109
1,定向,定向是一个汉语词汇，读音为dìng xiàng，一般指转向指定的方向，包括事物的方向性、动物主动调整其身体或身体某部分的空间位置的行为等方面。,https://baike.baidu.com/item/%E5%AE%9A%E5%90%91/35699
1,序号,序号，有顺序的号码，如1，2，3，4......大写汉字也算数字序号，如一，二，三，四……序号可以清晰的分清同一类事物，也可以用序号作文章的小标题。第一层为“一、二、三”，第二层为”（一） （二） （三）“，第三层为1.2.3，第四层为（1）（2）（3），第五层为①②③。,https://baike.baidu.com/item/%E5%BA%8F%E5%8F%B7/5437364
1,职称,职称（Professional Title）最初源于职务名称，理论上职称是指专业技术人员的专业技术水平、能力，以及成就的等级称号，是反映专业技术人员的技术水平、工作能力的标志。随着社会发展的需要，逐步产生了对专业技术人员的水平评价与聘任岗位相分离的需要，即“评聘分离”，职称的概念也相应发生了变化。聘任的岗位称之为“专业技术职务”，简称职务；而专业技术人员的水平则以“专业技术职务任职资格”来标识，简称职称。,https://baike.baidu.com/item/%E8%81%8C%E7%A7%B0/1035081
1,中医药,中医药，是包括汉族和少数民族医药在内的我国各民族医药的统称，反映了中华民族对生命、健康和疾病的认识，具有悠久历史传统和独特理论及技术方法的医药学体系。2020年3月27日，根据中华人民共和国国务院令第726号，对“中华人民共和国中医药条例（2003年4月7日中华人民共和国国务院令第374号公布）”予以废止。,https://baike.baidu.com/item/%E4%B8%AD%E5%8C%BB%E8%8D%AF/1584465
1,检定,由法制计量部门或法定授权组织按照检定规程，通过实验，提供证明，来确定测量器具的示值误差满足规定要求的活动。,https://baike.baidu.com/item/%E6%A3%80%E5%AE%9A/5858941
1,中药,以中国传统医药理论指导采集、炮制、制剂，说明作用机理，指导临床应用的药物，统称为中药。简而言之，中药就是指在中医理论指导下，用于预防、治疗、诊断疾病并具有康复与保健作用的物质。中药主要来源于天然药及其加工品，包括植物药、动物药、矿物药及部分化学、生物制品类药物。由于中药以植物药居多，故有“诸药以草为本”的说法。,https://baike.baidu.com/item/%E4%B8%AD%E8%8D%AF/295975
1,中医药大学,中医药大学（University of Traditional Chinese Medicine）是指以培养现代化中医药人才为特色的医科类高校，中医药大学一般是一省一校，而且各地的中医药大学都有自己的独有特色。中医药院校（中医药大学）和西医院校（医科大学），在院校设置上有较大的区别，中医药大学是一个相对独立的体系。2017年入选国家“双一流”建设的中医药大学有北京中医药大学、天津中医药大学、上海中医药大学、南京中医药大学、广州中医药大学、成都中医药大学。,https://baike.baidu.com/item/%E4%B8%AD%E5%8C%BB%E8%8D%AF%E5%A4%A7%E5%AD%A6/3023201
1,总局,国家广播电影电视总局，曾是负责广播电影电视和信息网络视听节目服务的法律法规草案、宣传创作的方针政策、舆论导向和创作导向的把握、事业产业发展规划、节目的进口和收录管理、活动宣传交流监管等一系列与影视娱乐相关的业务的国务院直属机构之一，其前身为广播电影电视部。2013年3月，根据第十二届全国人民代表大会第一次会议审议的《国务院关于提请审议国务院机构改革和职能转变方案》的议案，组建国家新闻出版广电总局，不再保留国家广播电影电视总局、国家新闻出版总署。,https://baike.baidu.com/item/%E5%9B%BD%E5%AE%B6%E5%B9%BF%E6%92%AD%E7%94%B5%E5%BD%B1%E7%94%B5%E8%A7%86%E6%80%BB%E5%B1%80/1053801
1,食品药品,中华人民共和国国家食品药品监督管理总局（CFDA）是国务院综合监督管理药品、医疗器械、化妆品、保健食品和餐饮环节食品安全的直属机构，负责起草食品（含食品添加剂、保健食品，下同）安全、药品（含中药、民族药，下同）、医疗器械、化妆品监督管理的法律法规草案，制定食品行政许可的实施办法并监督实施，组织制定、公布国家药典等药品和医疗器械标准、分类管理制度并监督实施，制定食品、药品、医疗器械、化妆品监督管理的稽查制度并组织实施，组织查处重大违法行为。2018年3月，根据第十三届全国人民代表大会第一次会议批准的国务院机构改革方案，将国家食品药品监督管理总局的职责整合，组建中华人民共和国国家市场监督管理总局；不再保留国家食品药品监督管理总局。[3-4],https://baike.baidu.com/item/%E5%9B%BD%E5%AE%B6%E9%A3%9F%E5%93%81%E8%8D%AF%E5%93%81%E7%9B%91%E7%9D%A3%E7%AE%A1%E7%90%86%E6%80%BB%E5%B1%80/7649782
1,朱晓新,朱晓新，男，医学博士，二级研究员，博士研究生导师，中国中医研究院中药研究所副所长，医学博士，研究员，兼任中国中西医结合学会中药专业委员会副主任委员，中国中西医结合学会活血化瘀专业委员会委员、中国药理学会制药工业专业委员会委员。2004年聘为博士生导师。第十届国家药典委员会委员，国家自然科学委员会生命科学部专家评审组成员，卫生部有突出贡献中青年专家，享受政府特殊津贴专家。国家中医药管理局中药药理、中药理论重点学科学术带头人，中国中医科学院中药药理学科带头人。,https://baike.baidu.com/item/%E6%9C%B1%E6%99%93%E6%96%B0/8096454
1,唐健元,,https://baike.baidu.com/item/唐健元

1,张伯礼,张伯礼，1948年2月26日出生于天津，籍贯河北宁晋，中共党员，中医内科专家，中国工程院院士、医药卫生学部主任，中国医学科学院学部委员，天津中医药大学校长，中国中医科学院名誉院长，“重大新药创制”科技重大专项技术副总师，国家重点学科中医内科学科带头人。[1-2]张伯礼1982年毕业于天津中医学院，获得中医内科学硕士学位；1992年任天津中医学院中医工程研究所所长；1999年任天津中医学院第一附属医院副院长；2002年任天津中医学院院长；2005年当选中国工程院院士；2006年任天津中医药大学校长；2010年任中国中医科学院院长；2011年被授予“全国优秀共产党员”称号；2014年获得国家科学技术进步奖一等奖；2016年获得吴阶平医学奖；2017年被授予“全国名中医”称号；2019年获得全国中医药杰出贡献奖，并被聘为中国医学科学院学部委员；2020年8月被授予“人民英雄”国家荣誉称号。[2-5]张伯礼长期从事心脑血管疾病防治和中医药现代化研究工作。,https://baike.baidu.com/item/%E5%BC%A0%E4%BC%AF%E7%A4%BC/1521965
1,审评,,https://baike.baidu.com//item/%E5%AE%A1%E8%AF%84%E6%9D%AF
1,研究员,根据中华人民共和国人事部职称管理评审制度规定，职称是对技术人员工作能力的表述，是由职称评定委员会评审的。研究员是自然科学研究或社会科学研究系列职称，属于正高级职称。研究员职称系列包括实习研究员（初级），助理研究员（中级），副研究员（副高），研究员（正高）。,https://baike.baidu.com/item/%E7%A0%94%E7%A9%B6%E5%91%98/8703381
1,北京中医药大学,北京中医药大学（Beijing University of Chinese Medicine），简称“北中医”，是中华人民共和国教育部直属的一所以中医药学科为特色的全国重点大学，由教育部、国家卫生健康委员会、国家中医药管理局、北京市共同建设，是国家首批世界一流学科建设高校，国家“211工程”、“985工程优势学科创新平台”建设高校，卓越医生（中医）教育培养计划改革试点高校，世界一流中医药大学建设联盟、北京卓越医学人才培养高校联盟创始成员，入选国家“111计划”、国家建设高水平大学公派研究生项目、国家大学生创新性实验计划、国家级大学生创新创业训练计划、全国深化创新创业教育改革示范高校、教育部来华留学示范基地、中国政府奖学金来华留学生接收院校。北京中医药大学始建于1956年，前身为北京中医学院，是国务院批准最早创办的高等中医药院校。1960年，学校被中央确定为全国重点高校；1971年，学校与中国中医研究院合并；1977年，两院分开，分别恢复独立办学；1993年，学校更名为北京中医药大学；1996年，入选国家“211工程”重点建设大学；2000年，学校与北京针灸骨伤学院合并，组建新的北京中医药大学。截至2019年12月，学校有和平街校区、望京校区和良乡校区3个校区，占地面积108.30万平方米；下设14个教学单位，12个本科专业；有8所直属附属医院，4所非直属附属医院，5所非直属临床医学院，8所教学医院；教职工5120人；全日制在校生12602人，其中研究生4504人，本科生7536人，留学生562人。[2-3],https://baike.baidu.com/item/%E5%8C%97%E4%BA%AC%E4%B8%AD%E5%8C%BB%E8%8D%AF%E5%A4%A7%E5%AD%A6/437783
