page_id,keyword,annotation,url
1,许继集团,许继集团有限公司是国家电网公司直属产业单位，是中国电力装备行业的大型骨干和龙头企业，产品覆盖发电、输电、配电、用电等电力系统各个环节，横跨一二次、高中压、交直流装备领域，是国内综合配套能力最强、最具竞争力的电力装备制造商及系统解决方案提供商，核心主导业务是智能变配电、智能用电、电动汽车充换电及驱动控制、直流输电及电力电子、新能源并网及发电、工业及军工智能供用电、轨道交通智能牵引供用电等电力装备的制造和系统解决方案的提供。许继集团设有2家行业归口研究所、3家国家级产品检测中心、1个国家级工程研究中心、3个国家标准化委员会秘书处、1个国际标准化委员会主席席位。拥有1家上市公司、14家主要子（分）公司，形成了许昌、北京2个公司级研发中心，珠海、上海、哈尔滨、福州4个研发分中心以及许昌、珠海、厦门、福州、济南5个制造基地。2019河南企业100强榜单排名第25位。,https://baike.baidu.com/item/%E8%AE%B8%E7%BB%A7%E9%9B%86%E5%9B%A2/5871371
1,周逢权,宁远一中是湖南省示范性高级中学，省现代教育技术实验学校 、全国中小学公民道德建设实验学校、省体育传统项目学校、省绿色学校。学校坐落在舜文化的发祥之地——九疑山下的宁远县城。自1942年创办以来，为国家培养了3万多名合格的初、高中毕业生，1982年以来，有29名学生考入清华，北大。仅近 五年，就为清华、北大输送新生11人，有9名学生获得省、市、县文理科状元。 学校占地240亩，建筑面积60000平方米，有高中教学班76个，创办的民办附属学校——桂冠学校，有初中班32个，全校在校学生达6500个。,https://baike.baidu.com/item/%E5%AE%81%E8%BF%9C%E5%8E%BF%E7%AC%AC%E4%B8%80%E4%B8%AD%E5%AD%A6/9622238
1,张文生,张文生，中国科学院自动化研究所研究员。,https://baike.baidu.com/item/%E5%BC%A0%E6%96%87%E7%94%9F/5501731
1,王兆其,王兆其，博士，中国科学院计算技术研究所，研究员，博士生导师。,https://baike.baidu.com/item/%E7%8E%8B%E5%85%86%E5%85%B6/8059428
1,黄永友,黄永友，男，原任华南师大附中历史科科组长，现任高三级组长。毕业于华中师范大学历史文化学院，曾任广州市历史教研会高三中心组组长，在职攻读华南师大教育硕士。华附在线（爱学网）特聘老师。,https://baike.baidu.com/item/%E9%BB%84%E6%B0%B8%E5%8F%8B/10625522
1,仲崇权,仲崇权，男，毕业于大连理工大学，博士，大连理工大学教授、博士生导师、硕士生导师。现任大连理工大学电子信息与电气工程学部控制科学与工程学院计算机控制研究所所长，科技部先进制造技术领域科技规划专家，工业装备节能控制技术国家地方联合工程实验室主任，工业装备监测与控制教育部工程研究中心主任。全国工业过程测量和控制标准化技术委员会PLC分委会副主任委员，全国消防标准化技术委员会消防通信分技术委员会副主任委员。中国计算机学会工业控制计算机专业委员会副主任委员，辽宁省自动化学会理事，信息与控制杂志编委等。多年来一直从事数据采集术、现场总线技术、可编程控制技术、运动控制技术和组态监控技术等方面的研究，参与制定了国家标准6项，国际标准5项。入选辽宁省“新世纪百千万人才工程”百人层次，大连市第四批和第五批优秀专家，享受大连市政府特殊津贴。先后承担并完成国家863重点项目6项，国家科技支撑项目1项，以及省市科技项目等多项。获得国家技术发明二等奖1项，中国国家标准创新贡献一等奖1项，中国专利优秀奖1项，中国电子信息科学技术二等奖1项，辽宁省技术发明二等奖1项，辽宁省科技进步二等奖1项，大连市技术发明一等奖1项，大连市科技进步一等奖3项；取得发明专利25项，软件著作权登记15项，发表论文100多篇。,https://baike.baidu.com/item/%E4%BB%B2%E5%B4%87%E6%9D%83/9749857
1,孙林夫,孙林夫，男，1963年7月生，浙江绍兴人，无党派人士，西南交通大学教授，博士生导师，西南交通大学CAD工程中心主任，四川省现代服务科技研究院院长，第十届、十一届全国政协委员，国务院政府特殊津贴获得者，“十一五”国家863计划先进制造技术领域专家组专家，国家科技支撑计划重大项目“现代服务业共性技术支撑体系”专家总体组责任专家，全国优秀科技工作者。获得詹天佑青年奖、霍英东青年奖。2013年1月，孙林夫教授主持的科技成果“基于ASP/ SaaS的制造业产业价值链协同平台”获得国家科学技术进步奖二等奖。,https://baike.baidu.com/item/%E5%AD%99%E6%9E%97%E5%A4%AB/3799759
1,大连理工大学,大连理工大学（Dalian University of Technology）简称大工，坐落于大连，是中华人民共和国教育部直属的全国重点大学，教育部与国家国防科技工业局共建高校，教育部、辽宁省、大连市共建高校，“世界一流大学建设高校A类”，国家“985工程”、“211工程”重点建设高校，卓越大学联盟、中俄工科大学联盟、中俄交通大学联盟、中欧工程教育平台、全国16所工科重点大学科技工作研讨会、中国人工智能教育联席会主要成员，入选国家“2011计划”、“111计划”、卓越工程师教育培养计划、国家建设高水平大学公派研究生项目、新工科研究与实践项目、中国政府奖学金来华留学生接收院校、国家实施工程教育改革试点高校、国家大学生创新性实验计划、国家级大学生创新创业训练计划、全国首批深化创新创业教育改革示范高校、首批全国高校实践育人创新创业基地、首批高等学校科技成果转化和技术转移基地。大连理工大学的前身是创建于1949年4月的大连大学工学院；1950年7月大连大学建制撤销，大连大学工学院独立为大连工学院；1988年3月更名为大连理工大学。截至2020年1月，学校设有大连凌水、开发区、盘锦等三个校区，总占地面积357.13万平方米，建筑面积约175.5万平方米；设有6个学部，17个独立建制的学院、教学部，3个专门学院和1所独立学院，共开设88个本科专业；拥有29个一级学科博士点，42个一级学科硕士点，25个博士后科研流动站；有教职工4082人，博士生4737人，硕士生13171人，本科生25611人。,https://baike.baidu.com/item/大连理工大学

1,王建民,王建民（1980年3月31日－）是中国台湾旅美职业棒球选手。2000年，加盟美国职棒大联盟豪门纽约洋基队，并站稳先发投手位置。2006年被美国《体育画报》评选为当年“最受瞩目的20位运动员”之一；同年还被美国职棒大联盟官网的球迷票选为“年度最佳先发投手”；2007年和2008年，王建民连续两年入选美国《时代》杂志全球最具影响力的百大人物之一。生于台湾省台南市的他，就读崇学小学期间，因为不喜欢念书且身高过人而加入篮球校队，在兼任篮球与棒球校队教练的鼓励下，他开始打棒球，在崇学小学少年棒球队中担当投手，小学时即赢得出国比赛的名额。,https://baike.baidu.com/item/%E7%8E%8B%E5%BB%BA%E6%B0%91/4918547
1,杨志家,杨志家，山西省太原城市职业技术学院院长，副教授，工学学士，法学学士。荣获“太原市新长征突击手”、“优秀党务工作者”、“职业教育先进工作者”。,https://baike.baidu.com/item/%E6%9D%A8%E5%BF%97%E5%AE%B6/7504332
1,自动化,自动化（Automation）是指机器设备、系统或过程（生产、管理过程）在没有人或较少人的直接参与下，按照人的要求，经过自动检测、信息处理、分析判断、操纵控制，实现预期的目标的过程。自动化技术广泛用于工业、农业、军事、科学研究、交通运输、商业、医疗、服务和家庭等方面。采用自动化技术不仅可以把人从繁重的体力劳动、部分脑力劳动以及恶劣、危险的工作环境中解放出来，而且能扩展人的器官功能，极大地提高劳动生产率，增强人类认识世界和改造世界的能力。因此，自动化是工业、农业、国防和科学技术现代化的重要条件和显著标志。,https://baike.baidu.com/item/%E8%87%AA%E5%8A%A8%E5%8C%96/323170
1,中科院,中国科学院（英文名称：Chinese Academy of Sciences，简称中科院）成立于1949年11月，为中国自然科学最高学术机构、科学技术最高咨询机构、自然科学与高技术综合研究发展中心。中国科学院提出了建设国家创新体系的构想，先后实施知识创新工程、“创新2020”、《“率先行动”计划暨全面深化改革纲要》，提出了《迎接知识经济时代，建设国家创新体系》、《创新促进发展，科技引领未来》、《创新2050：科学技术与中国的未来》、《科技发展新态势与面向2020年的战略选择》等战略研究报告。据2018年11月中国科学院官网显示，全院共拥有12个分院、100多家科研院所、3所大学（中国科学院大学、中国科学技术大学，与上海市共建上海科技大学）、130多个国家级重点实验室和工程中心、210多个野外观测台站，承担20余项国家重大科技基础设施的建设与运行，正式职工7.1万余人，在学研究生6.4万余人；建成了完整的自然科学学科体系，物理、化学、材料科学、数学、环境与生态学、地球科学等学科整体水平已进入世界先进行列，一些领域方向也具备了进入世界第一方阵的良好态势。在解决关系国家全局和长远发展的重大问题上，已成为不可替代的国家战略科技力量。一批科学家在国家重大科技任务中发挥了关键和中坚作用，并作为我国科技界的代表活跃在国际科技前沿。2019年9月，经党中央批准，十九届中央第四轮巡视将对中国科学院党组织开展常规巡视。,https://baike.baidu.com/item/%E4%B8%AD%E5%9B%BD%E7%A7%91%E5%AD%A6%E9%99%A2/271375
1,海洋大学,中国海洋大学（Ocean University of China，OUC），简称中国海大、海大，位于山东省青岛市，是中华人民共和国教育部直属的全国重点大学，是国家“世界一流大学建设高校”（A类）、“985工程”和“211工程”重点建设高校，入选“2011计划”、“111计划”、卓越工程师教育培养计划、卓越农林人才教育培养计划、国家大学生创新性实验计划、国家建设高水平大学公派研究生项目、新工科研究与实践项目、中国政府奖学金来华留学生接收院校，为中欧精英大学联盟、北极大学、国际南极学院、国际涉海大学联盟成员，全国首批博士、硕士学位授予单位。学校前身是创办于1924年的私立青岛大学。1930年，在省立山东大学和私立青岛大学基础上成立国立青岛大学。后历经国立山东大学、山东大学时期，1958年山东大学主体迁往济南，以留青的海洋系、水产系、地质系、生物系等为基础，于1959年3月成立山东海洋学院。1960年被国家确定为全国13所重点综合性大学之一。1988年更名为青岛海洋大学。2002年更名为中国海洋大学。截至2019年12月，学校辖崂山、鱼山和浮山三个校区，在建中国海洋大学西海岸校区、中国海洋大学深圳研究院、三亚研究生院；设有19个学院，1个基础教学中心；有教职工3678人，中国科学院院士5人，中国工程院院士9人；全日制在校生27300余人，其中本科生15000余人、硕士10400余人、博士1900余人；有9个学科进入ESI全球科研机构排名前1%。2017年世界大学学术排名中，学校居全球第301-400位。,https://baike.baidu.com/item/%E4%B8%AD%E5%9B%BD%E6%B5%B7%E6%B4%8B%E5%A4%A7%E5%AD%A6/253350
1,研究员,根据中华人民共和国人事部职称管理评审制度规定，职称是对技术人员工作能力的表述，是由职称评定委员会评审的。研究员是自然科学研究或社会科学研究系列职称，属于正高级职称。研究员职称系列包括实习研究员（初级），助理研究员（中级），副研究员（副高），研究员（正高）。,https://baike.baidu.com/item/%E7%A0%94%E7%A9%B6%E5%91%98/8703381
