page_id,keyword,annotation,url
1,年夫顺,年夫顺，1962年生，安徽怀远人。1989年毕业于西安交通大学获硕士学位。现任中国电子科技集团有限公司第四十一研究所首席科学家。,https://baike.baidu.com/item/%E5%B9%B4%E5%A4%AB%E9%A1%BA/1734166
1,庆安,庆安县是隶属黑龙江省绥化市的一个县，位于黑龙江省中部的松嫩平原与小兴安岭余脉的交汇地带，属呼兰河流域中上游。面积5469平方公里，辖14个乡镇、93个村，总人口41.2万。哈佳铁路、哈伊公路、鸡讷公路穿境而过，距哈尔滨170公里。庆安县属于低山丘陵平原区，属寒温带大陆性季风气候，适宜种植水稻、玉米、大豆等作物。庆安是国家绿色食品A级水稻生产基地，2019年全国村庄清洁行动先进县，享有“中国绿色食品之乡”的美誉。,https://baike.baidu.com/item/%E5%BA%86%E5%AE%89%E5%8E%BF/10100232
1,杨智君,,https://baike.baidu.com//item/%E6%9D%A8%E6%99%BA%E5%90%9B
1,第四十一,《第四十一》是格里高利·丘赫莱依执导的战争片，伊佐尔达·伊兹维茨卡娅和奥列格·斯特里仁诺夫出演。该片讲述了苏联国内战争期间，两个阶级不同、信仰不同、文化修养不同、追求不同的青年男女的爱情悲剧。,https://baike.baidu.com/item/%E7%AC%AC%E5%9B%9B%E5%8D%81%E4%B8%80/3697481
1,高级,高级，汉语词语，指超过一般的。,https://baike.baidu.com/item/%E9%AB%98%E7%BA%A7/2816151
1,爱华,爱华，女，本名夏洛特·麦金尼斯（Charlotte MacInnis），美国人，1981年2月21日出生于美国的密歇根州，中央电视台外籍主持人，美国哥伦比亚大学戏剧表演专业学士毕业。1988年随父母迁居至中国江苏南京，从此开始接受中国教育。1995年全家迁往北京，与姐姐正式改名为“爱中”、“爱华”。曾在中国中央电视台的《正大综艺》节目中的“一笑茶园”栏目中扮演“茶博士”。,https://baike.baidu.com/item/%E7%88%B1%E5%8D%8E/35463
1,地质,地质泛指地球的性质和特征。主要是指地球的物质组成、结构、构造、发育历史等，包括地球的圈层分异、物理性质、化学性质、岩石性质、矿物成分、岩层和岩体的产出状态、接触关系，地球的构造发育史、生物进化史、气候变迁史，以及矿产资源的赋存状况和分布规律等。在我国，“地质”一词最早见于三国时魏国王弼（226～249）的《周易注·坤》，但当时属于哲学概念。1853年（清咸丰三年）出版的《地理全书》中的“地质”一词是我国目前所能见到的最早具有科学意义的概念。,https://baike.baidu.com/item/%E5%9C%B0%E8%B4%A8/1222845
1,军医大学,各军医大学均承担军队、国家医学科研任务，是重要的科学研究基地，在军队、国家科技创新体系中占有重要地位。为适应未来军队建设的需要，军医大学将由原来以学历教育为主向学历教育与任职教育并重转型，充分发挥人才和智力优势，更加突出军事医学特色，全面提升整体办学质量和水平，为部队培养更多高素质医学专业人才。,https://baike.baidu.com/item/%E5%86%9B%E5%8C%BB%E5%A4%A7%E5%AD%A6/3375837
1,查钢强,,https://baike.baidu.com//item/%E6%9F%A5%E9%92%A2%E5%BC%BA
1,西北工业大学,西北工业大学（Northwestern Polytechnical University）简称“西工大”，位于陕西省会西安，直属中华人民共和国工业和信息化部，中央直管副部级建制，是中国唯一一所以同时发展航空、航天、航海（三航）工程教育和科学研究为特色的全国重点大学，位列国家“世界一流大学建设高校A类”、985工程、211工程；入选2011计划、111计划、卓越工程师教育培养计划、国家大学生创新性实验计划、新工科研究与实践项目、国家建设高水平大学公派研究生项目、中国政府奖学金来华留学生接收院校；卓越大学联盟、中俄工科大学联盟、中俄交通大学联盟、中英大学工程教育与研究联盟、“一带一路”航天创新联盟牵头成员，学位授权自主审核单位，欧盟QB50项目亚洲区唯一发起单位与亚洲区总协调单位。[1-2]1938年国立北洋工学院、国立北平大学工学院、国立东北大学工学院、私立焦作工学院在陕西汉中组建国立西北工学院；1946年迁至咸阳，1950年更名为西北工学院；1952年交通大学、浙江大学、南京大学的航空工程系在南京组建华东航空学院；1956年迁至西安，更名为西安航空学院；1957年，西北工学院与西安航空学院合并组建西北工业大学；1970年，原中国人民解放军军事工程学院航空工程系整体并入。截至2019年12月，学校友谊、长安及江苏太仓三个校区占地面积7100多亩，下设23个学院、67个本科专业；拥有21个博士后流动站、21个一级学科博士点、34个一级学科硕士点；教职工4000余人，全职院士7人，在校生2.9万余人。,https://baike.baidu.com/item/%E8%A5%BF%E5%8C%97%E5%B7%A5%E4%B8%9A%E5%A4%A7%E5%AD%A6/190114
1,良才,良才，汉语词汇。拼音：liáng cái释义：高才，多指本领高强，栋梁之才能人。,https://baike.baidu.com/item/%E8%89%AF%E6%89%8D/8781560
1,工程师,工程师指具有从事工程系统操作、设计、管理、评估能力的人员。工程师的称谓，通常只用于在工程学其中一个范畴持有专业性学位或相等工作经验的人士。工程师（Engineer）和科学家（Scientists）往往容易混淆。科学家努力探索大自然，以便发现一般性法则（General principles），工程师则遵照此既定原则，从而在数学和科学上，解决了一些技术问题。科学家研究事物，工程师建立事物。科学家探索世界以发现普遍法则，但工程师使用普遍法则以设计实际物品。工程师是职业水平评定（职称评定）的一种。其下，有技术员、助理工程师等职称；其上有高级工程师，教授级高级工程师等职称。当然，这也只是对从事工程建设或管理人员技术水平的一种标定而已。通常所说的工程师，是指中级工程师。工程师职称是要上级主管部门评定，全国通用。其中，2017年1月1日起，不再需要考中级英语职称考试和应用计算机考试。,https://baike.baidu.com/item/%E5%B7%A5%E7%A8%8B%E5%B8%88/474613
1,研究院,研究院，在学术界，称其为科学试验的研究机构。是大学之后的进阶教育研究机构，一般设于大学中，以“某大学某研究生院”的形式存在，也有独立设立者。研究院与研究生院是两个不同的概念，但港澳地区一般将“研究生院”称为“研究院”。,https://baike.baidu.com/item/%E7%A0%94%E7%A9%B6%E9%99%A2/5365502
1,研究所,研究所是指以科学研究为主要目的的社会企事业机构。在中国是一种完成为特殊科研目的和任务而建立的研究机构。随着社会的发展，现多以企业形式存在。在学术界，称其为科学试验的研究部门。研究所一直是国家重点扶持和照顾的对象，特别是军工类的研究所，比如航天两大集团，中电集团，航空，中船等重点研究所，一直是很多名校毕业生就业的首选。,https://baike.baidu.com/item/%E7%A0%94%E7%A9%B6%E6%89%80/1884021
1,研究员,根据中华人民共和国人事部职称管理评审制度规定，职称是对技术人员工作能力的表述，是由职称评定委员会评审的。研究员是自然科学研究或社会科学研究系列职称，属于正高级职称。研究员职称系列包括实习研究员（初级），助理研究员（中级），副研究员（副高），研究员（正高）。,https://baike.baidu.com/item/%E7%A0%94%E7%A9%B6%E5%91%98/8703381
1,中国,中国，以华夏文明为源泉、中华文化为基础，是世界上历史最悠久的国家之一。中国各族人民共同创造了光辉灿烂的文化，具有光荣的革命传统。中国是以汉族为主体民族的多民族国家，通用汉语、汉字，汉族与少数民族统称为“中华民族”，又自称“炎黄子孙”、“龙的传人”。中国是世界四大文明古国之一。距今5800年前后，黄河、长江中下游以及西辽河等区域出现了文明起源迹象；距今5300年前后，中华大地各地区陆续进入了文明阶段；距今3800年前后，中原地区形成了更为成熟的文明形态，并向四方辐射文化影响力；后历经多次民族交融和朝代更迭，直至形成多民族国家的大一统局面。20世纪初辛亥革命后，废除了封建帝制，创立了资产阶级民主共和国。1949年中华人民共和国成立后，在中国大陆建立了人民民主专政的社会主义制度。中国疆域辽阔、民族众多，先秦时期的华夏族在中原地区繁衍生息，到了汉代通过文化交融使汉族正式成型，奠定了中国主体民族的基础。后又通过与周边民族的交融，逐步形成统一多民族国家的局面，而人口也不断攀升，宋代中国人口突破一亿，清代时期人口突破四亿，到2005年中国人口已突破十三亿。中国文化渊远流长、博大精深、绚烂多彩，是东亚文化圈的文化宗主国，在世界文化体系内占有重要地位，由于各地的地理位置、自然条件的差异，人文、经济方面也各有特点。传统文化艺术形式有诗词、戏曲、书法、国画等，而春节、元宵、清明、端午、中秋、重阳等则是中国重要的传统节日。[2-6],https://baike.baidu.com/item/%E4%B8%AD%E5%9B%BD/1122445
1,中国科学院,中国科学院（英文名称：Chinese Academy of Sciences，简称中科院）成立于1949年11月，为中国自然科学最高学术机构、科学技术最高咨询机构、自然科学与高技术综合研究发展中心。中国科学院提出了建设国家创新体系的构想，先后实施知识创新工程、“创新2020”、《“率先行动”计划暨全面深化改革纲要》，提出了《迎接知识经济时代，建设国家创新体系》、《创新促进发展，科技引领未来》、《创新2050：科学技术与中国的未来》、《科技发展新态势与面向2020年的战略选择》等战略研究报告。据2018年11月中国科学院官网显示，全院共拥有12个分院、100多家科研院所、3所大学（中国科学院大学、中国科学技术大学，与上海市共建上海科技大学）、130多个国家级重点实验室和工程中心、210多个野外观测台站，承担20余项国家重大科技基础设施的建设与运行，正式职工7.1万余人，在学研究生6.4万余人；建成了完整的自然科学学科体系，物理、化学、材料科学、数学、环境与生态学、地球科学等学科整体水平已进入世界先进行列，一些领域方向也具备了进入世界第一方阵的良好态势。在解决关系国家全局和长远发展的重大问题上，已成为不可替代的国家战略科技力量。一批科学家在国家重大科技任务中发挥了关键和中坚作用，并作为我国科技界的代表活跃在国际科技前沿。2019年9月，经党中央批准，十九届中央第四轮巡视将对中国科学院党组织开展常规巡视。,https://baike.baidu.com/item/%E4%B8%AD%E5%9B%BD%E7%A7%91%E5%AD%A6%E9%99%A2/271375
1,仪器仪表,仪器仪表（英文：instrumentation） 仪器仪表是用以检出、测量、观察、计算各种物理量、物质成分、物性参数等的器具或设备。真空检漏仪、压力表、测长仪、显微镜、乘法器等均属于仪器仪表。广义来说，仪器仪表也可具有自动控制、报警、信号传递和数据处理等功能，例如用于工业生产过程自动控制中的气动调节仪表，和电动调节仪表，以及集散型仪表控制系统也皆属于仪器仪表。,https://baike.baidu.com/item/%E4%BB%AA%E5%99%A8%E4%BB%AA%E8%A1%A8/1291650
