page_id,keyword,annotation,url
18,服务,服务是一个汉语词汇，拼音是fú wù。意思是指履行职务，为他人做事，并使他人从中受益的一种有偿或无偿的活动，不以实物形式而以提供劳动的形式满足他人某种特殊需要；也指任职。,https://baike.baidu.com/item/%E6%9C%8D%E5%8A%A1/85523
17,智能,智能，是智慧和能力的总称，中国古代思想家一般把智与能看做是两个相对独立的概念。也有不少思想家把二者结合起来作为一个整体看待。,https://baike.baidu.com/item/%E6%99%BA%E8%83%BD/66637
16,知识,知识是符合文明方向的，人类对物质世界以及精神世界探索的结果总和。知识，至今也没有一个统一而明确的界定。但知识的价值判断标准在于实用性，以能否让人类创造新物质，得到力量和权力等等为考量。有一个经典的定义来自于柏拉图：一条陈述能称得上是知识必须满足三个条件，它一定是被验证过的，正确的，而且是被人们相信的，这也是科学与非科学的区分标准。由此看来，知识属于文化，而文化是感性与知识上的升华，这就是知识与文化之间的关系。有关于知识的悖论是：知识如果不能改变行为，就没有用处；但是知识一旦改变了行为，知识本身就立刻失去意义——《未来简史》。,https://baike.baidu.com/item/%E7%9F%A5%E8%AF%86/74245
17,数字,数字分好几种，阿拉伯数字是最普遍的一种。阿拉伯数字并不是阿拉伯人发明的而是印度人发明的，实际应该列为印度语言，只是先传播到阿拉伯，然后传向世界的，所以称之为“阿拉伯数字”。数字是一种用来表示数的书写符号。不同的记数系统可以使用相同的数字。,https://baike.baidu.com/item/%E6%95%B0%E5%AD%97/6204
18,数字,数字分好几种，阿拉伯数字是最普遍的一种。阿拉伯数字并不是阿拉伯人发明的而是印度人发明的，实际应该列为印度语言，只是先传播到阿拉伯，然后传向世界的，所以称之为“阿拉伯数字”。数字是一种用来表示数的书写符号。不同的记数系统可以使用相同的数字。,https://baike.baidu.com/item/%E6%95%B0%E5%AD%97/6204
14,服务,服务是一个汉语词汇，拼音是fú wù。意思是指履行职务，为他人做事，并使他人从中受益的一种有偿或无偿的活动，不以实物形式而以提供劳动的形式满足他人某种特殊需要；也指任职。,https://baike.baidu.com/item/%E6%9C%8D%E5%8A%A1/85523
13,网络,网络是由若干节点和连接这些节点的链路构成，表示诸多对象及其相互联系。在1999年之前，人们一般认为网络的结构都是随机的。但随着Barabasi和Watts在1999年分别发现了网络的无标度和小世界特性并分别在世界著名的《科学》和《自然》杂志上发表了他们的发现之后，人们才认识到网络的复杂性。网络会借助文字阅读、图片查看、影音播放、下载传输、游戏、聊天等软件工具从文字、图片、声音、视频等方面给人们带来极其丰富的生活和美好的享受。,https://baike.baidu.com/item/%E7%BD%91%E7%BB%9C/143243
12,设计,设计是把一种设想通过合理的规划、周密的计划、通过各种方式表达出来的过程。人类通过劳动改造世界，创造文明，创造物质财富和精神财富，而最基础、最主要的创造活动是造物。设计便是造物活动进行预先的计划，可以把任何造物活动的计划技术和计划过程理解为设计。,https://baike.baidu.com/item/%E8%AE%BE%E8%AE%A1/290622
12,文化,文化（汉语拼音wén huà，英文culture），是人类社会相对于经济、政治而言的精神活动及其产物，分为物质文化和非物质文化。教育、科学、艺术皆属广义的文化，而政治、经济与文化相互关联、相互作用。实际给文化下一个准确的定义，非常困难。对文化这个概念的解读，人类也一直众说不一。,https://baike.baidu.com/item/%E6%96%87%E5%8C%96/23624
16,内容,内容是指事物所包含的实质性事物。一个艺术作品的表现、基本含义、意味或审美价值。内容关涉的是我们在艺术作品中感受到的感觉的、主观的、心理的和情感方面的意涵，与我们对描绘性方面的单纯知觉相对。,https://baike.baidu.com/item/%E5%86%85%E5%AE%B9/869297
15,阅读,1.阅读是运用语言文字来获取信息、认识世界、发展思维，并获得审美体验与知识的活动。它是从视觉材料中获取信息的过程。视觉材料主要是文字和图片，也包括符号、公式、图表等。2.阅读是一种主动的过程，是由阅读者根据不同的目的加以调节控制的,陶冶人们的情操，提升自我修养。阅读是一种理解、领悟、吸收、鉴赏、评价和探究文章的思维过程。阅读可以改变思想、获取知识，从而可能改变命运。,https://baike.baidu.com/item/%E9%98%85%E8%AF%BB/2745402
15,服务,服务是一个汉语词汇，拼音是fú wù。意思是指履行职务，为他人做事，并使他人从中受益的一种有偿或无偿的活动，不以实物形式而以提供劳动的形式满足他人某种特殊需要；也指任职。,https://baike.baidu.com/item/%E6%9C%8D%E5%8A%A1/85523
11,文化,文化（汉语拼音wén huà，英文culture），是人类社会相对于经济、政治而言的精神活动及其产物，分为物质文化和非物质文化。教育、科学、艺术皆属广义的文化，而政治、经济与文化相互关联、相互作用。实际给文化下一个准确的定义，非常困难。对文化这个概念的解读，人类也一直众说不一。,https://baike.baidu.com/item/%E6%96%87%E5%8C%96/23624
10,服务,服务是一个汉语词汇，拼音是fú wù。意思是指履行职务，为他人做事，并使他人从中受益的一种有偿或无偿的活动，不以实物形式而以提供劳动的形式满足他人某种特殊需要；也指任职。,https://baike.baidu.com/item/%E6%9C%8D%E5%8A%A1/85523
10,科技,社会上习惯于把科学和技术连在一起，统称为科学技术，简称科技。实际二者既有密切联系，又有重要区别。科学解决理论问题，技术解决实际问题。科学要解决的问题，是发现自然界中确凿的事实与现象之间的关系，并建立理论把事实与现象联系起来；技术的任务则是把科学的成果应用到实际问题中去。科学主要是和未知的领域打交道，其进展，尤其是重大的突破，是难以预料的；技术是在相对成熟的领域内工作，可以做比较准确的规划。,https://baike.baidu.com/item/%E7%A7%91%E5%AD%A6%E6%8A%80%E6%9C%AF/3348043
13,监管,监管是一个汉语词语，读音为jiān guǎn，意思是监视管理；监督管理，监视看管罪犯。《水浒传》等均有记载。,https://baike.baidu.com/item/%E7%9B%91%E7%AE%A1/81331
14,视听,视听，读音是shì tīng，汉语词语，意思是见闻。,https://baike.baidu.com/item/%E8%A7%86%E5%90%AC/6512178
9,服务,服务是一个汉语词汇，拼音是fú wù。意思是指履行职务，为他人做事，并使他人从中受益的一种有偿或无偿的活动，不以实物形式而以提供劳动的形式满足他人某种特殊需要；也指任职。,https://baike.baidu.com/item/%E6%9C%8D%E5%8A%A1/85523
8,服务,服务是一个汉语词汇，拼音是fú wù。意思是指履行职务，为他人做事，并使他人从中受益的一种有偿或无偿的活动，不以实物形式而以提供劳动的形式满足他人某种特殊需要；也指任职。,https://baike.baidu.com/item/%E6%9C%8D%E5%8A%A1/85523
11,乡村,乡村是指乡村地区人类各种形式的居住场所（即村落或乡村聚落），乡村一般风景宜人，空气清新，较适合人群居住，民风淳朴。,https://baike.baidu.com/item/%E4%B9%A1%E6%9D%91/67307
7,服务,服务是一个汉语词汇，拼音是fú wù。意思是指履行职务，为他人做事，并使他人从中受益的一种有偿或无偿的活动，不以实物形式而以提供劳动的形式满足他人某种特殊需要；也指任职。,https://baike.baidu.com/item/%E6%9C%8D%E5%8A%A1/85523
7,科技,社会上习惯于把科学和技术连在一起，统称为科学技术，简称科技。实际二者既有密切联系，又有重要区别。科学解决理论问题，技术解决实际问题。科学要解决的问题，是发现自然界中确凿的事实与现象之间的关系，并建立理论把事实与现象联系起来；技术的任务则是把科学的成果应用到实际问题中去。科学主要是和未知的领域打交道，其进展，尤其是重大的突破，是难以预料的；技术是在相对成熟的领域内工作，可以做比较准确的规划。,https://baike.baidu.com/item/%E7%A7%91%E5%AD%A6%E6%8A%80%E6%9C%AF/3348043
6,电子商务,电子商务是指以信息网络技术为手段，以商品交换为中心的商务活动；也可理解为在互联网、企业内部网和增值网上以电子交易方式进行交易活动和相关服务的活动，是传统商业活动各环节的电子化、网络化、信息化；以互联网为媒介的商业行为均属于电子商务的范畴。电子商务通常是指在全球各地广泛的商业贸易活动中，在因特网开放的网络环境下，基于客户端/服务端应用方式，买卖双方不谋面地进行各种商贸活动，实现消费者的网上购物、商户之间的网上交易和在线电子支付以及各种商务活动、交易活动、金融活动和相关的综合服务活动的一种新型的商业运营模式。各国政府、学者、企业界人士根据自己所处的地位和对电子商务参与的角度和程度的不同，给出了许多不同的定义。电子商务分为：ABC、B2B、B2C、C2C、B2M、M2C、B2A（即B2G）、C2A（即C2G）、O2O等。电子商务是因特网爆炸式发展的直接产物，是网络技术应用的全新发展方向。因特网本身所具有的开放性、全球性、低成本、高效率的特点，也成为电子商务的内在特征，并使得电子商务大大超越了作为一种新的贸易形式所具有的价值，它不仅会改变企业本身的生产、经营、管理活动，而且将影响到整个社会的经济运行与结构。以互联网为依托的“电子”技术平台为传统商务活动提供了一个无比宽阔的发展空间，其突出的优越性是传统媒介手段根本无法比拟的。,https://baike.baidu.com/item/%E7%94%B5%E5%AD%90%E5%95%86%E5%8A%A1/98106
5,应用,应用（Application），一般指手机和平板电脑的应用。在面向对象上通常分为个人用户应用与企业级应用，在移动端系统分类上主要包括iOS（如：同步推等）、Android（如：AirDroid、百度应用等）和windows phone的xap和appx。,https://baike.baidu.com/item/%E5%BA%94%E7%94%A8/3994271
6,服务,服务是一个汉语词汇，拼音是fú wù。意思是指履行职务，为他人做事，并使他人从中受益的一种有偿或无偿的活动，不以实物形式而以提供劳动的形式满足他人某种特殊需要；也指任职。,https://baike.baidu.com/item/%E6%9C%8D%E5%8A%A1/85523
4,知识,知识是符合文明方向的，人类对物质世界以及精神世界探索的结果总和。知识，至今也没有一个统一而明确的界定。但知识的价值判断标准在于实用性，以能否让人类创造新物质，得到力量和权力等等为考量。有一个经典的定义来自于柏拉图：一条陈述能称得上是知识必须满足三个条件，它一定是被验证过的，正确的，而且是被人们相信的，这也是科学与非科学的区分标准。由此看来，知识属于文化，而文化是感性与知识上的升华，这就是知识与文化之间的关系。有关于知识的悖论是：知识如果不能改变行为，就没有用处；但是知识一旦改变了行为，知识本身就立刻失去意义——《未来简史》。,https://baike.baidu.com/item/%E7%9F%A5%E8%AF%86/74245
9,不少,不少，读音是bù shǎo，汉语词语，意思是多；毫无。出自《书·大诰》。,https://baike.baidu.com/item/%E4%B8%8D%E5%B0%91/6676458
8,面向,面向，汉语词语，读音是miàn xiàng，意思是面对；站着或坐着朝向。适应…的需要；注重。,https://baike.baidu.com/item/%E9%9D%A2%E5%90%91/7823290
4,工具,工具原指工作时所需用的器具，后引申为达到、完成或促进某一事物的手段。工具是一个相对概念，因为其概念不是一个具体的物质，所以只要能使物质发生改变的物质，相对于那个能被它改变的物质而言就是工具。,https://baike.baidu.com/item/%E5%B7%A5%E5%85%B7/81891
3,信用,汉语词语，所谓信用，是指依附在人之间、单位之间和商品交易之间形成的一种相互信任的生产关系和社会关系。信誉构成了人之间、单位之间、商品交易之间的双方自觉自愿的反复交往，消费者甚至愿意付出更多的钱来延续这种关系。言不信者，行不果。人而无信，不知其可也！2019年7月，国务院办公厅印发《关于加快推进社会信用体系建设构建以信用为基础的新型监管机制的指导意见》。,https://baike.baidu.com/item/%E4%BF%A1%E7%94%A8/986088
3,服务,服务是一个汉语词汇，拼音是fú wù。意思是指履行职务，为他人做事，并使他人从中受益的一种有偿或无偿的活动，不以实物形式而以提供劳动的形式满足他人某种特殊需要；也指任职。,https://baike.baidu.com/item/%E6%9C%8D%E5%8A%A1/85523
2,示范,示范，读音为shì fàn，汉语词语，意思是做出榜样或典范,供人们学习；起示范作用；把事物摆出来或指出来使人知道。,https://baike.baidu.com/item/%E7%A4%BA%E8%8C%83/363731
1,现代,现代即帝国主义和无产阶级革命的时代；历史学上通常指无产阶级取得社会主义革命胜利的时代，称“现代”，也就是说赤色革命，用鲜血换回的年代，应该是鲜血和汗水凝结的时代，为“现代”。1917年俄国十月社会主义革命开辟了人类历史的新纪元，标志着世界现代历史的开端（后现代）。一般认为，中国现代历史始于1919年五四运动（进入新民主主义革命时期）超现代。,https://baike.baidu.com/item/%E7%8E%B0%E4%BB%A3/35440
2,项目,项目是人们通过努力，运用新的方法，将人力的、材料的和财务的资源组织起来，在给定的费用和时间约束规范内，完成一项独立的、一次性的工作任务，以期达到由数量和质量指标所限定的目标。叶圣陶《倪焕之》二五：“教育这个项目当然是不容轻易忽略的。” 洪深 《戏剧导演的初步知识》上篇二：“它们的式样、大小、制造的材料、使用的方法等等，项目繁多。” 秦牧 《艺海拾贝·核心》：“生动的语言和丰富的词汇，看来该是技巧性很强的一个项目了。”项目参数包括项目范围、质量、成本、时间、资源。美国项目管理协会（project Management Institute，PMI)在其出版的《项目管理知识体系指南》（Project Management Body of Knowledge，PMBOK）中为项目所做的定义是：项目是为创造独特的产品、服务或成果而进行的临时性工作。以下活动都可以称为一个项目：1、开发一项新产品；2、计划举行一项大型活动（如策划组织婚礼、大型国际会议等）；3、策划一次自驾游旅游；4、ERP的咨询、开发、实施与培训。,https://baike.baidu.com/item/%E9%A1%B9%E7%9B%AE/477803
1,服务业,服务业是指电子信息时代的产业总称。服务业概念在理论界尚有争议。一般认为服务业指从事服务产品的生产部门和企业的集合，2013年5月第二届京交会暨全球服务论坛北京峰会上，李克强指出要最大限度“松绑”服务业。,https://baike.baidu.com/item/%E6%9C%8D%E5%8A%A1%E4%B8%9A/2780385
5,贸易,贸易，是指买卖或交易行为的总称，通常指以货币为媒介的一切交换活动或行为。其活动范围，不仅包括商业所从事的商品交换活动，还包括商品生产者或他人所组织的商品买卖活动；不仅包括国内贸易，还包括国与国之间的国际贸易。在古代市场上，不仅有物质商品贸易，还有奴隶贸易。在现代市场上，除了有形的商品贸易外，还有技术、资金、信息、劳务，以及保险、旅游等无形的贸易活动。,https://baike.baidu.com/item/%E8%B4%B8%E6%98%93/275039
