page_id,keyword,annotation,url
7,单位,单位，指机关、团体或属于一个机关、团体的各个部门；指数学方面或物理方面计量事物的标准量的名称。一般有：米（m）、千米（km）、牛（顿） N、帕（斯卡）Pa等单位；在佛教传统意义上讲单位，特指长度、质量、时间等的定量单位，也有专门的术语如：刹那、一瞬、弹指、须臾等。准确的说，单位就是将一定数量物质的集合规定为“1” ，成为一个单位。从广义上讲：单位是一个相对概念，其为事物坐标系中的坐标轴中能构成个体的抽象概念。事物的最小单位为零。,https://baike.baidu.com/item/%E5%8D%95%E4%BD%8D/32292
6,国家,国家（State、Country）是由领土、人民、文化和政府四个要素组成的，国家也是政治地理学名词。从广义的角度，国家是指拥有共同的语言、文化、种族、领土、政府或者历史的社会群体。从狭义的角度，国家是一定范围内的人群所形成的共同体形式。在社会科学和人文地理范畴，国家是指被人民、文化、语言、地理区别出来的领土；被政治自治权区别出来的一块领地；一个领地或者邦国的人民；跟特定的人有关联的地区。一般国家行政管理当局是国家的象征，它是一种拥有治理一个社会的权力的国家机构，在一定的领土内拥有外部和内部的主权。国家概念：区域划分，有行政合法性，也就是合法权力。一个国家合法性是指一个政权的理性标准。理性标准是指司法审核标准，法制建立标准。在外语中如英语或法语，国家一词有多种解释，例如地理层面，政治层面，民族层面，这三种层面各有代表国家的单词。,https://baike.baidu.com/item/%E5%9B%BD%E5%AE%B6/17205
5,单位,单位，指机关、团体或属于一个机关、团体的各个部门；指数学方面或物理方面计量事物的标准量的名称。一般有：米（m）、千米（km）、牛（顿） N、帕（斯卡）Pa等单位；在佛教传统意义上讲单位，特指长度、质量、时间等的定量单位，也有专门的术语如：刹那、一瞬、弹指、须臾等。准确的说，单位就是将一定数量物质的集合规定为“1” ，成为一个单位。从广义上讲：单位是一个相对概念，其为事物坐标系中的坐标轴中能构成个体的抽象概念。事物的最小单位为零。,https://baike.baidu.com/item/%E5%8D%95%E4%BD%8D/32292
4,证明,证明是汉语词语，拼音是zhèng míng，指根据确实的材料判明人或事物的真实性。,https://baike.baidu.com/item/%E8%AF%81%E6%98%8E/3476
5,资金来源,资金来源是“资金运用”的对称。指企业、机关、事业单位或其他经济组织等所拥有的资金从一定渠道取得或形成的来源。如工业企业国家拨入的基金，银行借款，应付购货款，专用基金等。为了反映和监督各项资金来源的增减变动和结余，要设置一系列资金来源账户，并把一定日期的资金来源账户的余额按规定项目列入资金平衡表的资金来源 方。在实际工作中资金来源有时亦称“负债”。,https://baike.baidu.com/item/%E8%B5%84%E9%87%91%E6%9D%A5%E6%BA%90/5430767
7,回避,指司法人员由于对本案有利害关系或其他关系而不参加该案的侦察、审判等活动。司法人员因与案件或案件当事人有某种特殊关系而不得办理该案件。目的是防止徇私舞弊或发生偏见，以有利于案件的公正审理。审判人员、检察人员、侦察人员以及其他有关人员不参加与本人有利害关系或其他关系的案件的审判、检察或侦察。,https://baike.baidu.com/item/%E5%9B%9E%E9%81%BF/10296753
4,课题,所谓课题，指要研究、解决的问题，所以课题背景就是指该问题是在什么情况或条件下产生的，课题研究有什么意义，等等。课题包括：市级课题、省级课题、国家级课题等。,https://baike.baidu.com/item/%E8%AF%BE%E9%A2%98/2434814
6,基地,基地是开展某种活动的基础性地点，是某种活动的集中性支撑点，犹如某种活动的家园，即“工作之家”。,https://baike.baidu.com/item/%E5%9F%BA%E5%9C%B0/25304
7,专家,指在学术、技艺等方面有专门技能或专业知识全面的人；特别精通某一学科或某项技艺的有较高造诣的专业人士。,https://baike.baidu.com/item/%E4%B8%93%E5%AE%B6/3369419
3,单位,单位，指机关、团体或属于一个机关、团体的各个部门；指数学方面或物理方面计量事物的标准量的名称。一般有：米（m）、千米（km）、牛（顿） N、帕（斯卡）Pa等单位；在佛教传统意义上讲单位，特指长度、质量、时间等的定量单位，也有专门的术语如：刹那、一瞬、弹指、须臾等。准确的说，单位就是将一定数量物质的集合规定为“1” ，成为一个单位。从广义上讲：单位是一个相对概念，其为事物坐标系中的坐标轴中能构成个体的抽象概念。事物的最小单位为零。,https://baike.baidu.com/item/%E5%8D%95%E4%BD%8D/32292
3,加盖,加盖，拼音jiā gài，汉语词汇，把一纹章图形加在另一纹章图形上。,https://baike.baidu.com/item/%E5%8A%A0%E7%9B%96/7567077
3,公章,公章是指机关、团体、企事业单位使用的印章。 由于公安部对办理刻制印章的手续未作统一规定，所以各地公安机关对刻制印章手续的规定有所不同。根据刻制印章的种类不同，手续也不一样。,https://baike.baidu.com/item/%E5%85%AC%E7%AB%A0/10781999
1,可行性研究,feasibility study 在建设项目投资决策前对有关建设方案、技术方案或生产经营方案进行的技术经济论证。论证的依据是调研报告。,https://baike.baidu.com/item/%E5%8F%AF%E8%A1%8C%E6%80%A7%E7%A0%94%E7%A9%B6/2126806
2,申报,《申报》原名《申江新报》，1872年4月30日（清同治十一年三月二十三日）在上海创刊，1949年5月27日停刊。是近代中国发行时间最久、具有广泛社会影响的报纸，是中国现代报纸开端的标志。它前后总计经营了77年，历经晚清、北洋政府、国民政府三个时代，共出版27000余期，出版时间之长，影响之广泛，同时期其它报纸难以企及，在中国新闻史和社会史研究上都占有重要地位，被人称为研究中国近现代史的“百科全书”。,https://baike.baidu.com/item/%E7%94%B3%E6%8A%A5/3577852
1,课题,所谓课题，指要研究、解决的问题，所以课题背景就是指该问题是在什么情况或条件下产生的，课题研究有什么意义，等等。课题包括：市级课题、省级课题、国家级课题等。,https://baike.baidu.com/item/%E8%AF%BE%E9%A2%98/2434814
1,单位,单位，指机关、团体或属于一个机关、团体的各个部门；指数学方面或物理方面计量事物的标准量的名称。一般有：米（m）、千米（km）、牛（顿） N、帕（斯卡）Pa等单位；在佛教传统意义上讲单位，特指长度、质量、时间等的定量单位，也有专门的术语如：刹那、一瞬、弹指、须臾等。准确的说，单位就是将一定数量物质的集合规定为“1” ，成为一个单位。从广义上讲：单位是一个相对概念，其为事物坐标系中的坐标轴中能构成个体的抽象概念。事物的最小单位为零。,https://baike.baidu.com/item/%E5%8D%95%E4%BD%8D/32292
5,资金,资金是指经营工商业的本钱，同时也是指国家用于发展国民经济的物资或货币。资金是以货币表现，用来进行周转，满足创造社会物质财富需要的价值，它体现着以资料公有制为基础的社会主义生产关系。资金是垫支于社会再生产过程，用于创造新价值，并增加社会剩余产品价值的媒介价值，也是指资金管理，意思是说在任何一次交易中，只使你的一小部分资金承担风险。,https://baike.baidu.com/item/%E8%B5%84%E9%87%91/1671461
2,代码,代码就是程序员用开发工具所支持的语言写出来的源文件，是一组由字符、符号或信号码元以离散形式表示信息的明确的规则体系。代码设计的原则包括唯一确定性、标准化和通用性、可扩充性与稳定性、便于识别与记忆、力求短小与格式统一以及容易修改等。源代码是代码的分支，某种意义上来说，源代码相当于代码。现代程序语言中，源代码可以书籍或磁带形式出现，但最为常用格式是文本文件，这种典型格式的目的是为了编译出计算机程序。计算机源代码最终目的是将人类可读文本翻译成为计算机可执行的二进制指令，这种过程叫编译，它由通过编译器完成。,https://baike.baidu.com/item/%E4%BB%A3%E7%A0%81/86048
2,他人,,https://baike.baidu.com//item/%E5%88%AB%E4%BA%BA/16819222
