page_id,keyword,annotation,url
32,制造,把原材料加工成适用的产品制作，或将原材料加工成器物。也可指造成某种气氛或局面。,https://baike.baidu.com/item/%E5%88%B6%E9%80%A0/8681656
29,制造,把原材料加工成适用的产品制作，或将原材料加工成器物。也可指造成某种气氛或局面。,https://baike.baidu.com/item/%E5%88%B6%E9%80%A0/8681656
27,制造,把原材料加工成适用的产品制作，或将原材料加工成器物。也可指造成某种气氛或局面。,https://baike.baidu.com/item/%E5%88%B6%E9%80%A0/8681656
28,协同,协同一词来自古希腊语, 或曰协和、同步、和谐、协调、协作、合作, 是协同(Synergetics)的基本范畴。协同的定义, 《说文》提到“协, 众之同和也。同, 合会也”。所谓协同，就是指协调两个或者两个以上的不同资源或者个体，协同一致地完成某一目标的过程或能力。而所有有助于协同的软件都可以称作是协同软件。协同，按照康德关于范畴表中关于关系范畴的论述，协同至主动与受动之间的交互作用。,https://baike.baidu.com/item/%E5%8D%8F%E5%90%8C/5865610
30,注塑机,注塑机又名注射成型机或注射机。它是将热塑性塑料或热固性塑料利用塑料成型模具制成各种形状的塑料制品的主要成型设备。分为立式、卧式、全电式。注塑机能加热塑料，对熔融塑料施加高压，使其射出而充满模具型腔。,https://baike.baidu.com/item/%E6%B3%A8%E5%A1%91%E6%9C%BA/10926478
24,应用服务,应用服务器是指通过各种协议把商业逻辑曝露给客户端的程序。它提供了访问商业逻辑的途径以供客户端应用程序使用。应用服务器使用此商业逻辑就像调用对象的一个方法一样。,https://baike.baidu.com/item/%E5%BA%94%E7%94%A8%E6%9C%8D%E5%8A%A1%E5%99%A8/4971773
31,协同,协同一词来自古希腊语, 或曰协和、同步、和谐、协调、协作、合作, 是协同(Synergetics)的基本范畴。协同的定义, 《说文》提到“协, 众之同和也。同, 合会也”。所谓协同，就是指协调两个或者两个以上的不同资源或者个体，协同一致地完成某一目标的过程或能力。而所有有助于协同的软件都可以称作是协同软件。协同，按照康德关于范畴表中关于关系范畴的论述，协同至主动与受动之间的交互作用。,https://baike.baidu.com/item/%E5%8D%8F%E5%90%8C/5865610
21,价值链,价值链(value chain)概念首先由迈克尔·波特(Michael E.Porter)于1985年提出。最初，波特所指的价值链主要是指针对垂直一体化公司的，强调单个企业的竞争优势。随着国际外包业务的开展，波特于1998年进一步提出了价值体系(value system)的概念，将研究视角扩展到不同的公司之间，这与后来出现的全球价值链(global value chain)概念有一定的共通之处。之后，寇伽特(Kogut)也提出了价值链的概念，他的观点比波特的观点更能反映价值链的垂直分离和全球空间再配置之间的关系。2001年，格里芬在分析全球范围内国际分工与产业联系问题时，提出了全球价值链概念。全球价值链概念提供了一种基于网络、用来分析国际性生产的地理和组织特征的分析方法，揭示了全球产业的动态性特征。,https://baike.baidu.com/item/%E4%BB%B7%E5%80%BC%E9%93%BE/4766235
18,IP,IP地址（Internet Protocol Address）是指互联网协议地址，又译为网际协议地址。IP地址是IP协议提供的一种统一的地址格式，它为互联网上的每一个网络和每一台主机分配一个逻辑地址，以此来屏蔽物理地址的差异。,https://baike.baidu.com/item/IP%E5%9C%B0%E5%9D%80/150859
25,平台,,https://baike.baidu.com//item/%E5%B9%B3%E5%8F%B0/20155557
26,协同,协同一词来自古希腊语, 或曰协和、同步、和谐、协调、协作、合作, 是协同(Synergetics)的基本范畴。协同的定义, 《说文》提到“协, 众之同和也。同, 合会也”。所谓协同，就是指协调两个或者两个以上的不同资源或者个体，协同一致地完成某一目标的过程或能力。而所有有助于协同的软件都可以称作是协同软件。协同，按照康德关于范畴表中关于关系范畴的论述，协同至主动与受动之间的交互作用。,https://baike.baidu.com/item/%E5%8D%8F%E5%90%8C/5865610
19,技术,技术是解决问题的方法及方法原理，是指人们利用现有事物形成新事物，或是改变现有事物功能、性能的方法。技术应具备明确的使用范围和被其它人认知的形式和载体，如原材料（输入）、产成品（输出）、工艺、工具、设备、设施、标准、规范、指标、计量方法等。技术与科学相比，技术更强调实用，而科学更强调研究；技术与艺术相比，技术更强调功能，艺术更强调表达。,https://baike.baidu.com/item/%E6%8A%80%E6%9C%AF/832247
17,数字,数字分好几种，阿拉伯数字是最普遍的一种。阿拉伯数字并不是阿拉伯人发明的而是印度人发明的，实际应该列为印度语言，只是先传播到阿拉伯，然后传向世界的，所以称之为“阿拉伯数字”。数字是一种用来表示数的书写符号。不同的记数系统可以使用相同的数字。,https://baike.baidu.com/item/%E6%95%B0%E5%AD%97/6204
22,协同,协同一词来自古希腊语, 或曰协和、同步、和谐、协调、协作、合作, 是协同(Synergetics)的基本范畴。协同的定义, 《说文》提到“协, 众之同和也。同, 合会也”。所谓协同，就是指协调两个或者两个以上的不同资源或者个体，协同一致地完成某一目标的过程或能力。而所有有助于协同的软件都可以称作是协同软件。协同，按照康德关于范畴表中关于关系范畴的论述，协同至主动与受动之间的交互作用。,https://baike.baidu.com/item/%E5%8D%8F%E5%90%8C/5865610
15,智能,智能，是智慧和能力的总称，中国古代思想家一般把智与能看做是两个相对独立的概念。也有不少思想家把二者结合起来作为一个整体看待。,https://baike.baidu.com/item/%E6%99%BA%E8%83%BD/66637
16,智能,智能，是智慧和能力的总称，中国古代思想家一般把智与能看做是两个相对独立的概念。也有不少思想家把二者结合起来作为一个整体看待。,https://baike.baidu.com/item/%E6%99%BA%E8%83%BD/66637
14,成型,利用塑料的可挤压性与可模塑性，首先将松散的粒状或粉状原料从注塑机送入高温的料筒内加热，熔融塑化，使之成为粘流态熔体，以一定的压力和速度充入模具，经过保压、冷却后开启模具，就可获得一定形状和尺寸的塑料制品。,https://baike.baidu.com/item/%E6%88%90%E5%9E%8B/208721
20,供应链,供应链（Supply chain），是指生产及流通过程中，涉及将产品或服务提供给最终用户活动的上游与下游企业，所形成的网链结构。,https://baike.baidu.com/item/%E4%BE%9B%E5%BA%94%E9%93%BE/139061
23,APP,,https://baike.baidu.com//item/.app
13,刀具,刀具是机械制造中用于切削加工的工具，又称切削工具。 绝大多数的刀具是机用的，但也有手用的。由于机械制造中使用的刀具基本上都用于切削金属材料，所以“刀具”一词一般就理解为金属切削刀具。切削木材用的刀具则称为木工刀具。还有特别应用的一类刀具，用于地质勘探、打井、矿山钻探，称为矿山刀具。,https://baike.baidu.com/item/%E5%88%80%E5%85%B7/495981
9,物料,物料是我国生产领域中的一个专业术语。生产企业习惯将最终产品之外的、在生产领域流转的一切材料（不论其来自生产资料还是生活资料）、燃料、零部件、半成品、外协件以及生产过程中必然产生的边角余料、废料以及各种废物统称为“物料”。,https://baike.baidu.com/item/%E7%89%A9%E6%96%99/11000829
7,仿真,仿真（Simulation），即使用项目模型将特定于某一具体层次的不确定性转化为它们对目标的影响，该影响是在项目仿真项目整体的层次上表示的。项目仿真利用计算机模型和某一具体层次的风险估计，一般采用蒙特卡洛法进行仿真。,https://baike.baidu.com/item/%E4%BB%BF%E7%9C%9F/4330029
10,码头,码头是海边、江河边专供轮船或渡船停泊，让乘客上下、货物装卸的建筑物。通常见于水陆交通发达的商业城市。人类利用码头，作为渡轮泊岸上落乘客及货物之用，其次还可能是吸引游人，及约会集合的地标。在码头周边常见的建筑或设施有邮轮、渡轮、货柜船、仓库、海关、浮桥、鱼市场、海滨长廊、车站、餐厅、或者商场等。,https://baike.baidu.com/item/%E7%A0%81%E5%A4%B4/81196
12,跨域,《跨域》是漠粟写的网络小说连载于红袖添香网。,https://baike.baidu.com/item/%E8%B7%A8%E5%9F%9F/152671
4,智能,智能，是智慧和能力的总称，中国古代思想家一般把智与能看做是两个相对独立的概念。也有不少思想家把二者结合起来作为一个整体看待。,https://baike.baidu.com/item/%E6%99%BA%E8%83%BD/66637
5,ERP,ERP系统是企业资源计划 (Enterprise Resource Planning) 的简称，是指建立在信息技术基础上，集信息技术与先进管理思想于一身，以系统化的管理思想，为企业员工及决策层提供决策手段的管理平台。它是从MRP（物料需求计划）发展而来的新一代集成化管理信息系统，它扩展了MRP的功能，其核心思想是供应链管理。它跳出了传统企业边界，从供应链范围去优化企业的资源，优化了现代企业的运行模式，反映了市场对企业合理调配资源的要求。它对于改善企业业务流程、提高企业核心竞争力具有显著作用。,https://baike.baidu.com/item/ERP%E7%B3%BB%E7%BB%9F/1569198
6,ERP,ERP系统是企业资源计划 (Enterprise Resource Planning) 的简称，是指建立在信息技术基础上，集信息技术与先进管理思想于一身，以系统化的管理思想，为企业员工及决策层提供决策手段的管理平台。它是从MRP（物料需求计划）发展而来的新一代集成化管理信息系统，它扩展了MRP的功能，其核心思想是供应链管理。它跳出了传统企业边界，从供应链范围去优化企业的资源，优化了现代企业的运行模式，反映了市场对企业合理调配资源的要求。它对于改善企业业务流程、提高企业核心竞争力具有显著作用。,https://baike.baidu.com/item/ERP%E7%B3%BB%E7%BB%9F/1569198
11,锻件,锻件是指通过对金属坯料进行锻造变形而得到的工件或毛坯。利用对金属坯料施加压力，使其产生塑形变形，可改变其机械性能。锻件按坯料在加工时的温度，可分为冷锻温锻和热锻。冷锻一般是在室温下加工，热锻是在高于金属坯料的再结晶温度下加工。[1-2]锻件热处理按其热处理的目的不同可分为两组。通过锻造可消除金属的疏松。孔洞，使锻件的机械性能得以提高。,https://baike.baidu.com/item/%E9%94%BB%E4%BB%B6/9873429
3,精度,精度是表示观测值与真值的接近程度。每一种物理量要用数值表示时，必须先要制定一种标准，并选定一种单位 (unit)。这种标准的制定，通常是根据人们对于所要测量的物理量的认识与了解，并且要考虑这标准是否容易复制，或测量的过程是否容易操作等实际问题。,https://baike.baidu.com/item/%E7%B2%BE%E5%BA%A6/5167954
1,创新,创新是一个汉语词语，亦作“剏新”，一指创立或创造新的，二指首先。出自《南史·后妃传上·宋世祖殷淑仪》：“据《春秋》，仲子非鲁惠公元嫡，尚得考别宫。今贵妃盖天秩之崇班，理应创新。”,https://baike.baidu.com/item/%E5%88%9B%E6%96%B0/6047
8,工艺,工艺（ technology/craft）是指劳动者利用各类生产工具对各种原材料、半成品进行加工或处理，最终使之成为成品的方法与过程。制定工艺的原则是：技术上的先进和经济上的合理。由于不同的工厂的设备生产能力、精度以及工人熟练程度等因素都大不相同，所以对于同一种产品而言，不同的工厂制定的工艺可能是不同的；甚至同一个工厂在不同的时期做的工艺也可能不同。可见，就某一产品而言，工艺并不是唯一的，而且没有好坏之分。这种不确定性和不唯一性，和现代工业的其他元素有较大的不同。内画、玉雕等都是是中国特有的一种工艺形式。,https://baike.baidu.com/item/%E5%B7%A5%E8%89%BA/1392952
2,柔性,1、物理方面柔性英文为Flexible，也可解释为挠性，是相对刚性而言的一种物体特性。挠性是指物体受力后变形，作用力失去之后物体自身不能恢复原来形状的一种物理性质。而刚性物体受力后，在宏观来看其形状可视为没有发生改变。弹性是指物体受力后变形，作用力失去之后物体自身能恢复原来形状的一种物理性质。其侧重物体的变形结果，而挠性侧重物体自身性质。2、社会方面常用于柔性管理、柔性生产等词语。,https://baike.baidu.com/item/%E6%9F%94%E6%80%A7/300024
