page_id,keyword,annotation,url
8,毒素,毒素，是指生物体所生产出来的毒物，这些物质通常是一些会干扰生物体中其他大分子作用的蛋白质，例如蓖麻毒蛋白。由生物体产生的、极少量即可引起动物中毒的物质。,https://baike.baidu.com/item/%E6%AF%92%E7%B4%A0/6186813
7,毒素,毒素，是指生物体所生产出来的毒物，这些物质通常是一些会干扰生物体中其他大分子作用的蛋白质，例如蓖麻毒蛋白。由生物体产生的、极少量即可引起动物中毒的物质。,https://baike.baidu.com/item/%E6%AF%92%E7%B4%A0/6186813
8,深海,国际上对深海的定义是200米以下水深的海域。深海特点为：高压、底层水流速缓慢、无光、水温低，盐度高、氧含量较丰、沉积物多。,https://baike.baidu.com/item/%E6%B7%B1%E6%B5%B7/10308076
7,深海,国际上对深海的定义是200米以下水深的海域。深海特点为：高压、底层水流速缓慢、无光、水温低，盐度高、氧含量较丰、沉积物多。,https://baike.baidu.com/item/%E6%B7%B1%E6%B5%B7/10308076
6,粉砂,粉砂是一种粒径在0.0625至0.0039毫米之间的矿物或岩石碎粒，粒度介于砂和粘土颗粒之间。由暴露在地表的各种岩石经风化破碎而成。粉砂的成分与砂相似，但岩屑含量减少。粉砂分布于海滨、河流及湖泊沉积物中，其粘性差，具有透水性。,https://baike.baidu.com/item/%E7%B2%89%E7%A0%82/10489969
6,泥质,泥质结构（pelitic texture）又称粘土结构（clay texture），是粘土岩的特有结构。其特点是岩石中粘土物质占50%以上，由于混有不同含量的砂及粉砂，故存在一系列过渡型结构。,https://baike.baidu.com/item/%E6%B3%A5%E8%B4%A8%E7%BB%93%E6%9E%84/822490
6,混输,,https://baike.baidu.com//item/%E6%B2%B9%E6%B0%94%E6%B7%B7%E8%BE%93%E6%8E%A5%E8%BD%AC%E7%AB%99
5,原位,它的意思是部位、位置、现场。指事件发生的位点，多用于物理、化学、生物等学科中。,https://baike.baidu.com/item/%E5%8E%9F%E4%BD%8D/9465950
8,生物,《生物》是由人民教育出版社出版的教材，共四册，供七年级和八年级学生使用。,https://baike.baidu.com/item/%E7%94%9F%E7%89%A9/14895952
4,应用,应用（Application），一般指手机和平板电脑的应用。在面向对象上通常分为个人用户应用与企业级应用，在移动端系统分类上主要包括iOS（如：同步推等）、Android（如：AirDroid、百度应用等）和windows phone的xap和appx。,https://baike.baidu.com/item/%E5%BA%94%E7%94%A8/3994271
5,水合物,水合物指的是含有水的化合物，其范围相当广泛。其中水可以以配位键与其他部分相连，如水合金属离子，也可以是以共价键相结合，如水合三氯乙醛。也可以指是天然气中某些组分与水分在一定温度、压力条件下形成的白色晶体，外观类似致密的冰雪，密度为0.88~0.90 g/cm3。研究表明，水合物是一种笼形晶体包络物，水分子借氢键结合形成笼形结晶，气体分子被包围在晶格之中。,https://baike.baidu.com/item/%E6%B0%B4%E5%90%88%E7%89%A9/7636912
5,测试,测试是具有试验性质的测量，即测量和试验的综合。而测试手段就是仪器仪表。由于测试和测量密切相关，在实际使用中往往并不严格区分测试与测量。测试的基本任务就是获取有用的信息，通过借助专门的仪器、设备，设计合理的实验方法以及进行必要的信号分析与数据处理，从而获得与被测对象有关的信息。测试最终的结果是将显示的信息输入到信息处理库中，进行控制。,https://baike.baidu.com/item/测试

4,海上,海上，指海边，海面上；也指上海。并有同名诗人、诗歌、散文、古诗。,https://baike.baidu.com/item/%E6%B5%B7%E4%B8%8A/6545282
7,生物,《生物》是由人民教育出版社出版的教材，共四册，供七年级和八年级学生使用。,https://baike.baidu.com/item/%E7%94%9F%E7%89%A9/14895952
4,防污,防污就是防止污渍，其多用在一些名词的前面，做修饰，以显示物体的作用，比如防污涂料、防污剂、防污布料等等。,https://baike.baidu.com/item/%E9%98%B2%E6%B1%A1/4993551
3,通透,通透，读音tōng tòu，汉语词汇，意思是清澈透明，出自《南山诗》。,https://baike.baidu.com/item/%E9%80%9A%E9%80%8F/3678581
2,项目,项目是人们通过努力，运用新的方法，将人力的、材料的和财务的资源组织起来，在给定的费用和时间约束规范内，完成一项独立的、一次性的工作任务，以期达到由数量和质量指标所限定的目标。叶圣陶《倪焕之》二五：“教育这个项目当然是不容轻易忽略的。” 洪深 《戏剧导演的初步知识》上篇二：“它们的式样、大小、制造的材料、使用的方法等等，项目繁多。” 秦牧 《艺海拾贝·核心》：“生动的语言和丰富的词汇，看来该是技巧性很强的一个项目了。”项目参数包括项目范围、质量、成本、时间、资源。美国项目管理协会（project Management Institute，PMI)在其出版的《项目管理知识体系指南》（Project Management Body of Knowledge，PMBOK）中为项目所做的定义是：项目是为创造独特的产品、服务或成果而进行的临时性工作。以下活动都可以称为一个项目：1、开发一项新产品；2、计划举行一项大型活动（如策划组织婚礼、大型国际会议等）；3、策划一次自驾游旅游；4、ERP的咨询、开发、实施与培训。,https://baike.baidu.com/item/%E9%A1%B9%E7%9B%AE/477803
3,光电,由光的作用产生的电叫光电。以光电子学为基础，综合利用光学、精密机械、电子学和计算机技术解决各种工程应用课题的技术学科。信息载体正在由电磁波段扩展到光波段，从而使光电科学与光机电一体化技术集中在光信息获取、传输、处理、记录、存储、显示和传感等的光电信息产业上。,https://baike.baidu.com/item/%E5%85%89%E7%94%B5/2983109
3,连接器,电连接器除了要满足一般的性能要求外，特别重要的要求是电连接器必须达到接触良好，工作可靠，维护方便，其工作可靠与否直接影响飞机电路的正常工作，涉及整个主机的安危。为此，主机电路对电连接器的质量和可靠性有非常严格的要求，也正因为电连接器的高质量和高可靠性，使它也广泛应用于航空、航天、国防等军用系统中。电连接器常用的分类方法包括外形、结构、用途等。,https://baike.baidu.com/item/%E7%94%B5%E8%BF%9E%E6%8E%A5%E5%99%A8/306196
1,深海,国际上对深海的定义是200米以下水深的海域。深海特点为：高压、底层水流速缓慢、无光、水温低，盐度高、氧含量较丰、沉积物多。,https://baike.baidu.com/item/%E6%B7%B1%E6%B5%B7/10308076
1,重点,基本解释：1. [Stress;Main point;Focal point]∶重要的或主要的重点学校2. [Important point]∶指主要的或重要的一个或几个部分在一幅风景画中被用作重点的植物3. [Emphasize]∶着重地；有重点地重点培养,https://baike.baidu.com/item/%E9%87%8D%E7%82%B9/4660315
1,专项,特定的某个项目。例句：～训练。进行～检查。～资金。[1-2],https://baike.baidu.com/item/%E4%B8%93%E9%A1%B9/10927791
2,耐压,耐压测试（puncture test）是检验电器、电气设备、电气装置、电气线路和电工安全用具等承受过电压能力的主要方法之一。分工频耐压试验和直流耐压试验两种。工频耐压试验其试验电压为被试设备额定电压的一倍多至数倍，不低于1000V。其加压时间：对于以瓷和液体为主要绝缘的设备为1分钟，对于以有机固体为主要绝缘的设备为5分钟，对于电压互感器为3分钟，对于油浸电力电缆为10分钟。直流耐压试验可通过不同试验电压时泄漏电流的数值、绘制泄漏电流—电压特性曲线。电气设备经耐压试验能够发现绝缘的局部缺陷、受潮及老化。,https://baike.baidu.com/item/%E8%80%90%E5%8E%8B%E8%AF%95%E9%AA%8C/3909168
