page_id,keyword,annotation,url
1,职称,职称（Professional Title）最初源于职务名称，理论上职称是指专业技术人员的专业技术水平、能力，以及成就的等级称号，是反映专业技术人员的技术水平、工作能力的标志。随着社会发展的需要，逐步产生了对专业技术人员的水平评价与聘任岗位相分离的需要，即“评聘分离”，职称的概念也相应发生了变化。聘任的岗位称之为“专业技术职务”，简称职务；而专业技术人员的水平则以“专业技术职务任职资格”来标识，简称职称。,https://baike.baidu.com/item/%E8%81%8C%E7%A7%B0/1035081
1,学部,官署名。清末设立的中央教育行政机构。其原址位于西城区教育街1、3号，这里原是敬谨亲王府。,https://baike.baidu.com/item/%E5%AD%A6%E9%83%A8/3208339
1,同济大学,同济大学（Tongji University）简称“同济”，是中华人民共和国教育部直属，教育部与国家海洋局、上海市共建的全国重点大学；中央直管副部级建制高校，国家“世界一流大学建设高校”，国家“211工程”和“985工程”建设高校；入选国家“珠峰计划”、“强基计划”、“2011计划”、“111计划”、卓越工程师教育培养计划、卓越法律人才教育培养计划、卓越医生教育培养计划、国家大学生创新性实验计划、国家建设高水平大学公派研究生项目、中国政府奖学金来华留学生接收院校、国家级大学生创新创业训练计划、国家创新人才培养示范基地、新工科研究与实践项目、全国深化创新创业教育改革示范高校、中美“10+10”计划，首批学位授权自主审核单位，联合国环境规划署全球环境与可持续发展大学合作联盟主席单位，国际设计艺术院校联盟、21世纪学术联盟、卓越大学联盟、中俄工科大学联盟、中欧工程教育平台、中国绿色大学联盟、国际绿色校园联盟、同济—伯克利工程联盟成员。同济大学前身是1907年德国医生埃里希·宝隆在上海创办的德文医学堂；1908年改名同济德文医学堂；1912年与创办不久的同济德文工学堂合称同济德文医工学堂；1923年正式定名同济大学；1927年成为国立同济大学，是中国最早的七所国立大学之一。截至2019年11月，学校设有29个专业学院，9家附属医院。4个校区占地3810亩，总建筑面积181余万平方米。有全日制本科生18115人，硕士研究生12105人，博士研究生5766人。另有国际学生3575人。[1-3],https://baike.baidu.com/item/%E5%90%8C%E6%B5%8E%E5%A4%A7%E5%AD%A6/133590
1,厦门大学,厦门大学（Xiamen University），简称厦大（XMU），是由中华人民共和国教育部直属、中央直管副部级建制的综合性研究型全国重点大学，世界一流大学建设高校（A类），国家“211工程“和“985工程”重点建设高校，首批学位授权自主审核单位，入选国家“2011计划”、“珠峰计划”、“强基计划”、“111计划”、卓越工程师教育培养计划、卓越法律人才教育培养计划、卓越医生教育培养计划、国家大学生创新性实验计划、国家级大学生创新创业训练计划、新工科研究与实践项目、国家建设高水平大学公派研究生项目、国家创新人才培养示范基地、国家大学生文化素质教育基地、中国政府奖学金来华留学生接收院校、全国首批深化创新创业教育改革示范高校，全国大学生创新创业实践联盟牵头发起高校，中欧商校联盟、中国人工智能教育联席会创始会员，大学通识教育联盟、CDIO工程教育联盟成员，教育部、国家国防科技工业局、福建省和厦门市重点共建。厦门大学由爱国华侨领袖陈嘉庚先生于1921年创办，是中国近代教育史上第一所华侨创办的大学，国内最早招收研究生的大学之一，是首个在海外建设独立校园的大学，早期建筑入选全国重点文物保护单位和“首批中国20世纪建筑遗产”名录，被誉为“南方之强“、“中国最美大学”。[2-3]截至2019年11月，学校4个校区占地9700多亩，其中马来西亚分校约900亩；有研究生院、6个学部、29个学院和15个研究院；有专任教师2662人，两院院士22人；在校学生40000余人，本研比约为1:1。[4-5],https://baike.baidu.com/item/%E5%8E%A6%E9%97%A8%E5%A4%A7%E5%AD%A6/192083
1,组学,组学(Omics)主要包括基因组学（Genomics），蛋白组学（Proteinomics），代谢组学（Metabolomics），转录组学(transcriptomics），脂类组学（lipidomics）， 免疫组学（Immunomics），糖组学（glycomics ）， RNA组学(RNomics)学，影像组学（Radiomics），超声组学（Ultrasomics）等。 Omics是组学的英文称谓，它的词根'-ome'英译是一些种类个体的系统集合，例如Genome（基因组）是构成生物体所有基因的组合，基因组学（Genomics）这门学科就是研究这些基因以及这些基因间的关系。,https://baike.baidu.com/item/%E7%BB%84%E5%AD%A6/9110802
1,季维智,季维智，男，汉族，安徽合肥人，中共党员，生于 1950年6月29日。昆明理工大学灵长类转化医学研究院院长，昆明理工大学特聘教授，博士研究生导师。历任中国科学院昆明研究室副主任、主任、副所长。历任中国科学院昆明研究所第四任所长、所党委委员、研究员。云南省动物生殖生物学重点实验室主任。2017年11月，当选中国科学院院士。,https://baike.baidu.com/item/%E5%AD%A3%E7%BB%B4%E6%99%BA/2182309
1,李小英,李小英，男，教授，博士生导师，上海交通大学医学院附属瑞金医院内分泌代谢科主任医师。,https://baike.baidu.com/item/%E6%9D%8E%E5%B0%8F%E8%8B%B1/1004443
1,军事科学院,中国人民解放军军事科学院成立于1958年3月15日，位于北京西山脚下，是中国共产党中央军事委员会直接领导下的军事科学研究机关，是全军军事科学研究中心，是计划协调全军军事科学研究工作的机构。军事科学院的军事科学研究工作是国家与军队军事思想与理论重要的“智囊团”“思想库”和“信息源”。军事科学院长期以来一直进行着军事基础理论和国防建设、军队建设重大问题的研究；编修军队的条令、条例和其他有关的军事法规；为中央军委和总部机关提供战略性建议和咨询，提供军事学术研究的相关信息；组织协调全军的军事学术研究工作，进行全军的军事科研管理工作。截至2017年7月，军事科学院设有军事战略、作战理论与条令、军队建设、军事历史与百科、外国军事以及军队政治工作等领域的研究部门，负责中国军事科学学会的日常工作。截至2016年10月，军事科学院拥有5个一级学科博士点、2个二级学科博士点、5个一级学科硕士点。[1-2],https://baike.baidu.com/item/%E4%B8%AD%E5%9B%BD%E4%BA%BA%E6%B0%91%E8%A7%A3%E6%94%BE%E5%86%9B%E5%86%9B%E4%BA%8B%E7%A7%91%E5%AD%A6%E9%99%A2/2266811
1,医科大学,医科大学，是比医学院整体实力更高的医学院校的命名，一般当一所医学院达到或超过医科大学的条件要求可以向当地教育厅和教育部申请升格为医科大学。目前，中国独立设置的医科大学按其综合实力及地区影响力，前五名为：首都医科大学、中国医科大学、南方医科大学、天津医科大学和南京医科大学。,https://baike.baidu.com/item/%E5%8C%BB%E7%A7%91%E5%A4%A7%E5%AD%A6/5182447
1,研究所,研究所是指以科学研究为主要目的的社会企事业机构。在中国是一种完成为特殊科研目的和任务而建立的研究机构。随着社会的发展，现多以企业形式存在。在学术界，称其为科学试验的研究部门。研究所一直是国家重点扶持和照顾的对象，特别是军工类的研究所，比如航天两大集团，中电集团，航空，中船等重点研究所，一直是很多名校毕业生就业的首选。,https://baike.baidu.com/item/%E7%A0%94%E7%A9%B6%E6%89%80/1884021
1,高绍荣,高绍荣，中国科学院动物研究博士，教授、博士生导师，同济大学生命科学与技术学院院长，转化医学高等研究院副院长。国家杰出青年科学基金获得者。,https://baike.baidu.com/item/%E9%AB%98%E7%BB%8D%E8%8D%A3/7202211
1,理工大学,北京理工大学（Beijing Institute of Technology）是中国共产党创办的第一所理工科大学，隶属于中华人民共和国工业和信息化部，中央直管副部级建制，首批进入世界一流大学建设高校A类行列，首批进入国家“211工程”、“985工程”，入选学位授权自主审核单位、高等学校学科创新引智计划、高等学校创新能力提升计划、卓越工程师教育培养计划、国家建设高水平大学公派研究生项目、国家大学生创新性实验计划、国家级大学生创新创业训练计划、新工科研究与实践项目、中国政府奖学金来华留学生接收院校、全国深化创新创业教育改革示范高校、首批高等学校科技成果转化和技术转移基地，工业和信息化部高校联盟、中国人工智能教育联席会成员。北京理工大学前身是1940年成立于延安的自然科学院，历经晋察冀边区工业专门学校、华北大学工学院等办学时期，1949年定址北京并接收中法大学校本部和数理化三个系，1952年定名为北京工业学院，1988年更名为北京理工大学。截至2020年3月，学校占地188公顷，建筑面积161万平方米，图书馆馆藏276.55万册，固定资产总额64.47亿元；教职工总数3420人，其中专任教师2284人；有全日制在校生28460人，其中本科生14727人，硕士生8381人，博士生4274人，学位留学生1105人；设有18个专业学院以及徐特立学院；开办72个本科专业；拥有一级学科博士学位授权点27个，博士专业学位授权点4个，一级学科硕士学位授权点30个，硕士专业学位授权点16个，博士后科研流动站22个。[1-2],https://baike.baidu.com/item/%E5%8C%97%E4%BA%AC%E7%90%86%E5%B7%A5%E5%A4%A7%E5%AD%A6/133615
1,宋保亮,宋保亮，男，1975年1月19日出生于河南省林州市（林县）。1997年于南京大学获学士学位，2002年于中国科学院上海生命科学研究院生物化学与细胞生物学研究所获博士学位，其后在美国西南医学中心进行博士后研究。2005年获中国科学院“百人计划”引进国外杰出人才项目资助，任上海生科院生化与细胞所研究组长、研究员。担任科技部重大蛋白质研究计划首席科学家，获国家杰出青年基金支持，“百人计划”终期评估优秀。2014年2月28日，经武汉大学党委研究决定，宋保亮任武汉大学生命科学学院院长，任期从2014年3月1日起。2019年9月，获得2019年“科学探索奖”。,https://baike.baidu.com/item/%E5%AE%8B%E4%BF%9D%E4%BA%AE/2760540
1,发育,发育指生命现象的发展，是一个有机体从其生命开始到成熟的变化，是生物有机体的自我构建和自我组织的过程。发育的时期称为青春期，是个体由儿童向成年人过渡的时期。通常人们把青春期与儿童期加以明显区分，区分的界限是性的成熟。对于男性来说，性成熟的标志是射精，（通常在夜间睡眠时射精，即遗精，但也有手淫射精的）；女性是月经初潮，即第一次来月经。,https://baike.baidu.com/item/%E5%8F%91%E8%82%B2/572518
1,军事医学,《军事医学》创刊于1956年，是由中国人民解放军军事医学科学院主管、主办的综合性学术刊物。据2018年第01期期刊内页显示，《军事医学》编辑委员会有编委56人、责任编委1人，编辑部有责任编辑1人。据2020年5月14日中国知网显示，《军事医学》共出版文献6869篇、总被下载761476次、总被引22248次、（2019版）复合影响因子为0.596、（2019版）综合影响因子为0.457。据2020年5月14日万方数据知识服务平台显示，《军事医学》共载文3969篇、基金论文量2238篇、被引量为14994次、下载量为301088次，2017年影响因子为0.65。,https://baike.baidu.com/item/%E5%86%9B%E4%BA%8B%E5%8C%BB%E5%AD%A6/7342553
1,国家自然科学基金,国家自然科学基金是20世纪80年代初，为推动我国科技体制改革，变革科研经费拨款方式，中国科学院89位院士（学部委员）致函党中央、国务院建议的。随后，在邓小平同志的亲切关怀下，国务院于1986年2月14日批准成立国家自然科学基金委员会。自然科学基金坚持支持基础研究，逐渐形成和发展了由研究项目、人才项目和环境条件项目三大系列组成的资助格局。三十多年来，自然科学基金在推动我国自然科学基础研究的发展，促进基础学科建设，发现、培养优秀科技人才等方面取得了巨大成绩。,https://baike.baidu.com/item/%E5%9B%BD%E5%AE%B6%E8%87%AA%E7%84%B6%E7%A7%91%E5%AD%A6%E5%9F%BA%E9%87%91/9951549
1,研究员,根据中华人民共和国人事部职称管理评审制度规定，职称是对技术人员工作能力的表述，是由职称评定委员会评审的。研究员是自然科学研究或社会科学研究系列职称，属于正高级职称。研究员职称系列包括实习研究员（初级），助理研究员（中级），副研究员（副高），研究员（正高）。,https://baike.baidu.com/item/%E7%A0%94%E7%A9%B6%E5%91%98/8703381
1,孟安明,孟安明，1963年7月22日出生，四川大竹人，发育生物学家，中国科学院院士，发展中国家科学院院士，清华大学教授。1983年7月孟安明毕业于西南农学院（西南大学）农学系；1990年获英国诺丁汉大学博士学位；1993年任中国农业大学生物学院动物生理生化系副教授；2006年加入九三学社；2007年当选为中国科学院院士；2008年任中国科学院动物研究所常务副所长、所长。孟安明主要从事胚胎早期发育分子机理方面的研究；利用斑马鱼做模式动物，研究脊椎动物胚胎发育中合子基因组激活、胚层诱导、图式形成的分子机制。,https://baike.baidu.com/item/%E5%AD%9F%E5%AE%89%E6%98%8E/5205642
1,生命,地球生命的定义：具有能量代谢功能，能回应刺激及进行繁殖的开放性系统。生命来自于能量：能量→植物、微生物、动物等。生命个体都要经历出生、成长和死亡。生命种群则在一代代个体的更替中，依靠基因的随机变异不断地向现实作趋同演化。宇宙哲学认为生命是自发重演于现在的合律宇宙精神。但为了包含无法排除的，未知的生命形式的存在，生命的定义必须足够普遍甚至是模糊，才能包含尽可能广泛的生命形式。而生命本身是一个过程，生命体是这个过程的载体，这使得生命和生命体的定义十分困难。目前并没有统一的、广泛认可的生命定义。这里给出一个尝试：生命是以繁殖为目的，以自发熵变为具体方式的进化和适应过程。（生命体当然是要降低自身的熵值，但这不总是成功的：有时因为自身稳态被破坏，比如衰老；有时因为无法完全抵抗外界的高熵压力。熵变主要应该是面向代谢及调节代谢的过程：物质的，能量的，信息的）,https://baike.baidu.com/item/%E7%94%9F%E5%91%BD/1417
