page_id,keyword,annotation,url
1,科技攻关,科技攻关项目，一般泛指是国民经济社会各领域，各行业在发展中需要的创新的科技项目，这科技项目代表着发展的方向目标范围，并且技术难度比较高，关键性，重要性，都需要集中力量攻克。,https://baike.baidu.com/item/%E7%A7%91%E6%8A%80%E6%94%BB%E5%85%B3%E9%A1%B9%E7%9B%AE/6312358
1,科研人员,科研人员也称为科技工作者，特指具备某一学科专业知识的而从事科学研究的高级知识分子。,https://baike.baidu.com/item/%E7%A7%91%E7%A0%94%E4%BA%BA%E5%91%98/6383502
1,重点,基本解释：1. [Stress;Main point;Focal point]∶重要的或主要的重点学校2. [Important point]∶指主要的或重要的一个或几个部分在一幅风景画中被用作重点的植物3. [Emphasize]∶着重地；有重点地重点培养,https://baike.baidu.com/item/%E9%87%8D%E7%82%B9/4660315
1,现对,软交换是一种功能实体，为下一代网络NGN提供具有实时性要求的业务的呼叫控制和连接控制功能，是下一代网络呼叫与控制的核心。 简单地看，软交换是实现传统程控交换机的“呼叫控制”功能的实体，但传统的“呼叫控制”功能是和业务结合在一起的，不同的业务所需要的呼叫控制功能不同，而软交换是与业务无关的，这要求软交换提供的呼叫控制功能是各种业务的基本呼叫控制。,https://baike.baidu.com/item/%E8%BD%AF%E4%BA%A4%E6%8D%A2/1180831
1,科技,社会上习惯于把科学和技术连在一起，统称为科学技术，简称科技。实际二者既有密切联系，又有重要区别。科学解决理论问题，技术解决实际问题。科学要解决的问题，是发现自然界中确凿的事实与现象之间的关系，并建立理论把事实与现象联系起来；技术的任务则是把科学的成果应用到实际问题中去。科学主要是和未知的领域打交道，其进展，尤其是重大的突破，是难以预料的；技术是在相对成熟的领域内工作，可以做比较准确的规划。,https://baike.baidu.com/item/%E7%A7%91%E5%AD%A6%E6%8A%80%E6%9C%AF/3348043
1,习近平,习近平，男，汉族，1953年6月生，陕西富平人，1969年1月参加工作，1974年1月加入中国共产党，清华大学人文社会学院马克思主义理论与思想政治教育专业毕业，在职研究生学历，法学博士学位。现任中国共产党中央委员会总书记，中共中央军事委员会主席，中华人民共和国主席，中华人民共和国中央军事委员会主席。,https://baike.baidu.com/item/习近平

1,研发,研发即研究开发、研究与开发、研究发展，是指各种研究机构、企业或个人为获得科学技术（不包括人文、社会科学）新知识，创造性运用科学技术新知识，或实质性改进技术、产品和服务而持续进行的具有明确目标的系统活动，包括系统及设备的测试，安装，维护，维修等一系列的系统活动。2016年2月，美国国家科学基金会发布的《美国科学与工程指标》显示，中国已成为不容置疑的世界第二研发大国。所了解，全球研发支出总体呈上升趋势，并仍集中在北美、欧洲及东亚和东南亚地区。美国仍然是世界第一研发大国，中国居第二位，中国的研发开支接近欧盟的总和。在按购买力平价计算的全球研发总支出当中，中国约占20%，仅次于美国（27%）；日本居第三位，占10%；德国第四，占6%；接下来是韩国、法国、俄罗斯、英国和印度，他们分别占全球研发支出总额的2%至4%。,https://baike.baidu.com/item/%E7%A0%94%E5%8F%91/4815440
1,意见建议,建议，是个人或团体，对某件事情未来要如何的操作，提出的解决问题的办法。又指通常是在适当的时候指针对一个人或一件事的客观存在，提出自己合理的见解或意见，使其具备一定的改革和改良的条件，使其向着更加良好的、积极的方面去完善和发展，是有益处的。出处魏巍《东方》第三部第十三章：“她的建议立刻得到热烈的响应。”,https://baike.baidu.com/item/%E5%BB%BA%E8%AE%AE/4719751
1,指示精神,城市精神是一个城市独具特质的精神品格和精神理念，是城市的灵魂，是凝聚和团结全体人民实现城市奋斗目标的共同信念和追求。哈尔滨城市精神是指哈尔滨这座城市在一定社会历史条件下，为谋求可持续发展，在长期的文化创造过程中积淀、整合、提炼出来的，反映城市共同的理想目标、精神信念、文化底蕴、行为准则和生活方式的价值观念体系和群体意识。它是构建城市先进文化的核心，是哈尔滨的城市之“魂”和动力之“源”。学习和弘扬哈尔滨城市精神，对加快实现哈尔滨的现代化建设和持续繁荣发展具有重要意义。,https://baike.baidu.com/item/%E5%93%88%E5%B0%94%E6%BB%A8%E5%9F%8E%E5%B8%82%E7%B2%BE%E7%A5%9E/292260
1,新冠,新冠自然村隶属于锡城镇新冠村委会，位于锡城镇西边，距离新冠村委会1.5公里，距离锡城镇5公里，是新冠村委会所在地。国土面积有1.26平方公里，海拔1800米，年平均气温15-16℃，年降水量1300毫米，适宜种植蔬菜、包谷等农作物。有耕地120.93亩，其中人均耕地0.287亩；有林地218.3亩。全村辖1个村民小组，有农户156户，有乡村人口455人，其中农业人口455人，劳动力339人，其中从事第一产业人数291人。2014年全村经济总收入3656万元，农民人均纯收入12780元。农民收入主要以经营收入为主。,https://baike.baidu.com/item/%E6%96%B0%E5%86%A0%E6%9D%91/9968534
1,填报,志愿填报是高考录取之前的一个项目，是考生进入大学的一个必经项目，关系到广大学子的命运。高考志愿表中，在院校、专业的下面设置一个“专业服从调剂与否”栏目，究竟填报“服从”还是“不服从”，要求考生必须在学校与专业之间进行一次博弈。当然，这里的基本前提一定不能忽略，即平行志愿的A、B、C、D四所院校之间一定要保持足够的、合理的级差，从高到低，依次应该有5至8分的距离。级差的确定则应当以往年(最好是近三年来)各个院校及其内部专业的录取分数线为依据，整理、分析出院校及专业的基本走势，这是填报志愿必须要做的基本功。然后，再对照自己的成绩或区域排名位次，做出适当的选择。,https://baike.baidu.com/item/%E5%BF%97%E6%84%BF%E5%A1%AB%E6%8A%A5/5289919
1,补充,补充，读音为bǔ chōng，汉语词语，意思是因不足或损失而加以添补。,https://baike.baidu.com/item/%E8%A1%A5%E5%85%85/2326085
1,企事,企事业单位是指企业单位及事业单位。企业单位是以盈利为目的独立核算的法人或非法人单位，企业单位包含国企和私企；事业单位是以政府职能、公益服务为主要宗旨的一些公益性单位、公益性职能部门等。国有企业，是指国家对其资本拥有所有权或者控制权，政府的意志和利益决定了国有企业的行为。国有企业是国民经济发展的中坚力量，是中国特色社会主义的支柱。[1-2]事业单位，是指由政府利用国有资产设立的，从事教育、科技、文化、卫生等活动的社会服务组织。事业单位接受政府领导，是表现形式为组织或机构的法人实体。,https://baike.baidu.com/item/%E4%BC%81%E4%BA%8B%E4%B8%9A%E5%8D%95%E4%BD%8D/1519477
1,凝练,凝练，汉语词语，拼音níng liàn，意思是紧凑简练，言简意赅。,https://baike.baidu.com/item/%E5%87%9D%E7%BB%83/8342657
1,单位,单位，指机关、团体或属于一个机关、团体的各个部门；指数学方面或物理方面计量事物的标准量的名称。一般有：米（m）、千米（km）、牛（顿） N、帕（斯卡）Pa等单位；在佛教传统意义上讲单位，特指长度、质量、时间等的定量单位，也有专门的术语如：刹那、一瞬、弹指、须臾等。准确的说，单位就是将一定数量物质的集合规定为“1” ，成为一个单位。从广义上讲：单位是一个相对概念，其为事物坐标系中的坐标轴中能构成个体的抽象概念。事物的最小单位为零。,https://baike.baidu.com/item/%E5%8D%95%E4%BD%8D/32292
1,组织,从广义上说，组织是指由诸多要素按照一定方式相互联系起来的系统。从狭义上说，组织就是指人们为实现一定的目标，互相协作结合而成的集体或团体，如党团组织、工会组织、企业、军事组织等等。狭义的组织专门指人群而言，运用于社会管理之中。在现代社会生活中．组织是人们按照一定的目的、任务和形式编制起来的社会集团，组织不仅是社会的细胞、社会的基本单元，而且可以说是社会的基础。从管理学的角度，所谓组织（Organization），是指这样一个社会实体，它具有明确的目标导向和精心设计的结构与有意识协调的活动系统，同时又同外部环境保持密切的联系。,https://baike.baidu.com/item/%E7%BB%84%E7%BB%87/10200
1,工作,工作，是一个汉语词语，具有动词、名词两种词性。作为动词用有操作、行动、运转、运作等意思。作为名词用有工程、制作、业务、任务、职业、从事各种手艺的人等意思。工作的概念是劳动生产，主要是指劳动。一个人的工作是他在社会中所扮演的角色。在社会主义国家，工作是社会分工中每个劳动者体现社会价值和自我价值的角色定位。所谓工作就是劳动者通过劳动（包括体力劳动和脑力劳动）将生产资料转换为生活资料以满足人们生存和继续社会发展事业的过程。一个人从事什么工作，由其所处社会环境和个人能力(包括认知)共同决定，因此不能用有色眼镜去看一个人所从事的工作。,https://baike.baidu.com/item/%E5%B7%A5%E4%BD%9C/82254
1,防控,风险防控是企业经营管理过程中的一个重要环节，为了进一步提高员工的风险防控意识。,https://baike.baidu.com/item/%E9%98%B2%E6%8E%A7%E9%A3%8E%E9%99%A9/3360267
1,征集,向特定的受众群体收集特定目标意见、意愿的行为。比如征集LOGO、征集广告语、征集吉祥物、征集征文、征集宣传语等等。例：1）现在发布的征集信息都是有奖征集。2）现向广大市民征集出行需求，用于新增公交线路。词语分开解释：征 : 征（③征⑦徵） zhēng 远行：长征。征途。征夫。征人。征衣。征帆（远行的船）。用武力制裁，讨伐。集 : 集 jí 群鸟栖止于树上：“黄鸟于飞，集于灌木”。聚合，会合：聚集。集合。集会。集体。集团。集训。,https://baike.baidu.com/item/%E5%BE%81%E9%9B%86/11013196
1,疫情,疫情，汉语词语，指疫病的发生和发展情况。较大范围内出现的较大型疫情有重症急性呼吸综合征（SARS）、甲型H1N1流感及新型冠状病毒肺炎（Corona Virus Disease 2019，COVID-19）等。,https://baike.baidu.com/item/%E7%96%AB%E6%83%85/1948250
1,需求,需求，读音xū qiú，汉语词语，意思是指人们在某一特定的时期内在各种可能的价格下愿意并且能够购买某个具体商品的需要。,https://baike.baidu.com/item/%E9%9C%80%E6%B1%82/3543925
