page_id,keyword,annotation,url
2,工程师,工程师指具有从事工程系统操作、设计、管理、评估能力的人员。工程师的称谓，通常只用于在工程学其中一个范畴持有专业性学位或相等工作经验的人士。工程师（Engineer）和科学家（Scientists）往往容易混淆。科学家努力探索大自然，以便发现一般性法则（General principles），工程师则遵照此既定原则，从而在数学和科学上，解决了一些技术问题。科学家研究事物，工程师建立事物。科学家探索世界以发现普遍法则，但工程师使用普遍法则以设计实际物品。工程师是职业水平评定（职称评定）的一种。其下，有技术员、助理工程师等职称；其上有高级工程师，教授级高级工程师等职称。当然，这也只是对从事工程建设或管理人员技术水平的一种标定而已。通常所说的工程师，是指中级工程师。工程师职称是要上级主管部门评定，全国通用。其中，2017年1月1日起，不再需要考中级英语职称考试和应用计算机考试。,https://baike.baidu.com/item/%E5%B7%A5%E7%A8%8B%E5%B8%88/474613
2,研究院,研究院，在学术界，称其为科学试验的研究机构。是大学之后的进阶教育研究机构，一般设于大学中，以“某大学某研究生院”的形式存在，也有独立设立者。研究院与研究生院是两个不同的概念，但港澳地区一般将“研究生院”称为“研究院”。,https://baike.baidu.com/item/%E7%A0%94%E7%A9%B6%E9%99%A2/5365502
2,清伟,清伟，出生于鹤壁朝歌镇，汉族，室内设计师。,https://baike.baidu.com/item/%E6%B8%85%E4%BC%9F/7149054
2,国家海洋局,国家海洋局（State Oceanic Administration），曾是由国土资源部管理的负责监督管理海域使用和海洋环境保护、依法维护海洋权益和组织海洋科技研究工作的国家局。2018年3月，根据第十三届全国人民代表大会第一次会议批准的国务院机构改革方案，将国家海洋局的职责整合；组建中华人民共和国自然资源部，自然资源部对外保留国家海洋局牌子；将国家海洋局的海洋环境保护职责整合，组建中华人民共和国生态环境部；将国家海洋局的自然保护区、风景名胜区、自然遗产、地质公园等管理职责整合，组建中华人民共和国国家林业和草原局，由中华人民共和国自然资源部管理；不再保留国家海洋局。,https://baike.baidu.com/item/%E5%9B%BD%E5%AE%B6%E6%B5%B7%E6%B4%8B%E5%B1%80/9930877
2,中国,中国，以华夏文明为源泉、中华文化为基础，是世界上历史最悠久的国家之一。中国各族人民共同创造了光辉灿烂的文化，具有光荣的革命传统。中国是以汉族为主体民族的多民族国家，通用汉语、汉字，汉族与少数民族统称为“中华民族”，又自称“炎黄子孙”、“龙的传人”。中国是世界四大文明古国之一。距今5800年前后，黄河、长江中下游以及西辽河等区域出现了文明起源迹象；距今5300年前后，中华大地各地区陆续进入了文明阶段；距今3800年前后，中原地区形成了更为成熟的文明形态，并向四方辐射文化影响力；后历经多次民族交融和朝代更迭，直至形成多民族国家的大一统局面。20世纪初辛亥革命后，废除了封建帝制，创立了资产阶级民主共和国。1949年中华人民共和国成立后，在中国大陆建立了人民民主专政的社会主义制度。中国疆域辽阔、民族众多，先秦时期的华夏族在中原地区繁衍生息，到了汉代通过文化交融使汉族正式成型，奠定了中国主体民族的基础。后又通过与周边民族的交融，逐步形成统一多民族国家的局面，而人口也不断攀升，宋代中国人口突破一亿，清代时期人口突破四亿，到2005年中国人口已突破十三亿。中国文化渊远流长、博大精深、绚烂多彩，是东亚文化圈的文化宗主国，在世界文化体系内占有重要地位，由于各地的地理位置、自然条件的差异，人文、经济方面也各有特点。传统文化艺术形式有诗词、戏曲、书法、国画等，而春节、元宵、清明、端午、中秋、重阳等则是中国重要的传统节日。[2-6],https://baike.baidu.com/item/%E4%B8%AD%E5%9B%BD/1122445
2,高级,高级，汉语词语，指超过一般的。,https://baike.baidu.com/item/%E9%AB%98%E7%BA%A7/2816151
2,环科,,https://baike.baidu.com//item/%E6%B2%88%E9%98%B3%E7%8E%AF%E7%A7%91%E7%A7%91%E6%8A%80%E6%9C%89%E9%99%90%E5%85%AC%E5%8F%B8
2,教授级,教授级高工，即教授级高级工程师。 高级工程师是中国专业技术职称工程类中的高级职称（职称改革后称为专业技术职务任职资格），也是工程师任职资格职称里的最高职称，而教授级高级工程师是高级工程师任职资格职称里的最高级别之一。,https://baike.baidu.com/item/%E6%95%99%E6%8E%88%E7%BA%A7%E9%AB%98%E7%BA%A7%E5%B7%A5%E7%A8%8B%E5%B8%88/6642240
1,北京科技大学,北京科技大学是中华人民共和国教育部直属的全国重点大学，是国家“世界一流学科建设高校”、国家“211工程”和“985工程优势学科创新平台”建设高校、教育部首批“三全育人”综合改革试点高校、首批北京市深化创新创业教育改革示范高校，入选卓越工程师教育培养计划、高等学校学科创新引智计划、高等学校创新能力提升计划、国家大学生创新性实验计划、国家建设高水平大学公派研究生项目、新工科研究与实践项目、教育部来华留学示范基地、中国政府奖学金来华留学生接收院校，是北京高科大学联盟、中欧工程教育平台、中俄工科大学联盟、CDIO工程教育联盟成员单位和中国人工智能教育联席会理事单位。1952年，由天津大学（原北洋大学）、清华大学、唐山铁道学院、山西大学、北京工业学院、西北工学院等高校的部分系科组建为北京钢铁工业学院；1960年，更名为北京钢铁学院；1988年，更名为北京科技大学。据2020年9月学校官网显示，学校有海淀、管庄、昌平3个校区，占地约80.39万平方米，校舍建筑总面积97万平方米；共有教职工总数3368人，其中专任教师1836人；设有14个二级学院、53个本科专业；拥有16个博士后科研流动站、20个一级学科博士学位授权点、30个一级学科硕士学位授权点、80个二级学科博士学位授权点、138个二级学科硕士学位授权点、8个专业学位授权类别。已形成研究生教育、全日制本科、高职教育和继续教育多层次、较完整的人才培养体系。[1-2],https://baike.baidu.com/item/%E5%8C%97%E4%BA%AC%E7%A7%91%E6%8A%80%E5%A4%A7%E5%AD%A6/136975
2,研究员,根据中华人民共和国人事部职称管理评审制度规定，职称是对技术人员工作能力的表述，是由职称评定委员会评审的。研究员是自然科学研究或社会科学研究系列职称，属于正高级职称。研究员职称系列包括实习研究员（初级），助理研究员（中级），副研究员（副高），研究员（正高）。,https://baike.baidu.com/item/%E7%A0%94%E7%A9%B6%E5%91%98/8703381
2,哈尔滨工程大学,哈尔滨工程大学（Harbin Engineering University）简称“哈工程”，是中华人民共和国工业和信息化部直属并由工业和信息化部、教育部、黑龙江省、哈尔滨市共建的全国重点大学，位列“世界一流学科建设高校”、“211工程”、“985工程优势学科创新平台”，入选高等学校学科创新引智计划、卓越工程师教育培养计划、国家大学生创新性实验计划、国家建设高水平大学公派研究生项目、国家级新工科研究与实践项目、中国政府奖学金来华留学生接收院校、全国首批深化创新创业教育改革示范高校、国家大学生文化素质教育基地、国家创新人才培养示范基地、全国高校实践育人创新创业基地，工业和信息化部高校联盟、北极大学联盟、CDIO工程教育联盟、中俄工科大学联盟成员单位，国际船舶与海洋工程创新与合作联盟牵头单位，被教育部、总政治部列入“21世纪人才强军计划”。[1-2]学校源自1953年创办的中国人民解放军军事工程学院（哈军工）；1970年，在哈军工原址以海军工程系为主体组建哈尔滨船舶工程学院；1981年成为首批具有博士、硕士学位授予权单位；1994年，更名为哈尔滨工程大学。截至2020年9月，学校占地面积138.35万平方米，建筑面积107.93万平方米，图书馆共有藏书705.65万册；设有17个学院（系、部），63个本科专业；拥有博士后科研流动站12个，博士后科研工作站2个，一级学科博士点14个，一级学科硕士点32个，博士专业学位类别2个，硕士专业学位类别9个；有教职工2907人；在校生29000余人。,https://baike.baidu.com/item/%E5%93%88%E5%B0%94%E6%BB%A8%E5%B7%A5%E7%A8%8B%E5%A4%A7%E5%AD%A6/235286
1,武汉理工大学,武汉理工大学是中华人民共和国教育部直属全国重点大学，首批国家世界一流学科建设高校，首批国家“211工程”建设高校，由教育部和交通运输部、国家国防科技工业局共建，入选985工程优势学科创新平台、“111计划”、卓越工程师教育培养计划、国家建设高水平大学公派研究生项目、新工科研究与实践项目、中国政府奖学金来华留学生接收院校、国家大学生文化素质教育基地。武汉理工大学办学源头起源于1898年湖广总督张之洞奏请清政府创办的湖北工艺学堂，2000年5月27日由原武汉工业大学、武汉交通科技大学、武汉汽车工业大学合并组建。武汉工业大学源于1948年的中国人民解放军东北军区军工部工业专门学校，历经传承与发展，1985年更名为武汉工业大学，1998年由原国家建筑材料工业局所属划转为教育部主管。武汉交通科技大学源于1946年的国立海事职业学校，历经传承与发展，1993年更名为武汉交通科技大学，隶属原交通部。武汉汽车工业大学源于1958年的武汉工学院，历经传承与发展，1995年更名为武汉汽车工业大学，隶属原中国汽车工业总公司。截至2020年6月，学校有马房山校区、余家头校区和南湖校区，占地近4000亩，总建筑面积178.28万平方米；在校普通本科生36000余人，博士、硕士生18000余人 ，留学生1700余人；有教职工5381人；设有25个学院（部），92个本科专业；拥有博士后科研流动站17个，一级学科博士点19个，一级学科硕士点45个，硕士专业学位授权类别22个，硕士专业学位授权领域39个。[2-3],https://baike.baidu.com/item/武汉理工大学

1,研究员级,研究员级高工，即研究员级高级工程师。 高级工程师是中国专业技术职称工程类中的高级职称（职称改革后称为专业技术职务任职资格），也是工程师任职资格职称里的最高职称，而研究员级高级工程师、教授级高级工程师是高级工程师任职资格职称里的最高级别之一。,https://baike.baidu.com/item/%E7%A0%94%E7%A9%B6%E5%91%98%E7%BA%A7%E9%AB%98%E5%B7%A5/6147680
1,科学,科学（Science）是一个建立在可检验的解释和对客观事物的形式、组织等进行预测的有序知识系统，是已系统化和公式化了的知识。根据科学反映对象的领域，主要分为自然科学、社会科学、思维科学、形式科学和交叉学科。,https://baike.baidu.com/item/%E7%A7%91%E5%AD%A6/10406
1,研究院,研究院，在学术界，称其为科学试验的研究机构。是大学之后的进阶教育研究机构，一般设于大学中，以“某大学某研究生院”的形式存在，也有独立设立者。研究院与研究生院是两个不同的概念，但港澳地区一般将“研究生院”称为“研究院”。,https://baike.baidu.com/item/%E7%A0%94%E7%A9%B6%E9%99%A2/5365502
1,遥感,遥感（remote sensing）是指非接触的，远距离的探测技术。一般指运用传感器/遥感器对物体的电磁波的辐射、反射特性的探测。遥感是通过遥感器这类对电磁波敏感的仪器，在远离目标和非接触目标物体条件下探测目标地物。获取其反射、辐射或散射的电磁波信息（如电场、磁场、电磁波、地震波等信息），并进行提取、判定、加工处理、分析与应用的一门科学和技术。,https://baike.baidu.com/item/%E9%81%A5%E6%84%9F/1240667
1,教授级,教授级高工，即教授级高级工程师。 高级工程师是中国专业技术职称工程类中的高级职称（职称改革后称为专业技术职务任职资格），也是工程师任职资格职称里的最高职称，而教授级高级工程师是高级工程师任职资格职称里的最高级别之一。,https://baike.baidu.com/item/%E6%95%99%E6%8E%88%E7%BA%A7%E9%AB%98%E7%BA%A7%E5%B7%A5%E7%A8%8B%E5%B8%88/6642240
2,教授,教授，是一种高等教育体系中的职称。多指在大学或社区学院中执教的资深教师与研究员，但教授与研究员是有区别的。教授有教课的任务，而研究员则没有。教授为大学教师职称的最高级别。中文的教授两字则源于“传教授业”的字义，是中国古代就使用的学官名称，在中国汉代、唐代的大学中都设此职位。这个词语与英文没有关联。日语中则与中文同用“教授”来称呼大学中的老师。,https://baike.baidu.com/item/%E6%95%99%E6%8E%88/18291
1,研究员,根据中华人民共和国人事部职称管理评审制度规定，职称是对技术人员工作能力的表述，是由职称评定委员会评审的。研究员是自然科学研究或社会科学研究系列职称，属于正高级职称。研究员职称系列包括实习研究员（初级），助理研究员（中级），副研究员（副高），研究员（正高）。,https://baike.baidu.com/item/%E7%A0%94%E7%A9%B6%E5%91%98/8703381
1,工程师,工程师指具有从事工程系统操作、设计、管理、评估能力的人员。工程师的称谓，通常只用于在工程学其中一个范畴持有专业性学位或相等工作经验的人士。工程师（Engineer）和科学家（Scientists）往往容易混淆。科学家努力探索大自然，以便发现一般性法则（General principles），工程师则遵照此既定原则，从而在数学和科学上，解决了一些技术问题。科学家研究事物，工程师建立事物。科学家探索世界以发现普遍法则，但工程师使用普遍法则以设计实际物品。工程师是职业水平评定（职称评定）的一种。其下，有技术员、助理工程师等职称；其上有高级工程师，教授级高级工程师等职称。当然，这也只是对从事工程建设或管理人员技术水平的一种标定而已。通常所说的工程师，是指中级工程师。工程师职称是要上级主管部门评定，全国通用。其中，2017年1月1日起，不再需要考中级英语职称考试和应用计算机考试。,https://baike.baidu.com/item/%E5%B7%A5%E7%A8%8B%E5%B8%88/474613
1,教授,教授，是一种高等教育体系中的职称。多指在大学或社区学院中执教的资深教师与研究员，但教授与研究员是有区别的。教授有教课的任务，而研究员则没有。教授为大学教师职称的最高级别。中文的教授两字则源于“传教授业”的字义，是中国古代就使用的学官名称，在中国汉代、唐代的大学中都设此职位。这个词语与英文没有关联。日语中则与中文同用“教授”来称呼大学中的老师。,https://baike.baidu.com/item/%E6%95%99%E6%8E%88/18291
1,高级,高级，汉语词语，指超过一般的。,https://baike.baidu.com/item/%E9%AB%98%E7%BA%A7/2816151
