page_id,keyword,annotation,url
1,吴顺清,吴顺清，男，中共党员，车管科司机，座右铭：以诚感人者，人亦诚而立。,https://baike.baidu.com/item/%E5%90%B4%E9%A1%BA%E6%B8%85/9480499
1,陆寿麟,陆寿麟，男，汉族，1940年3月生，江苏省苏州市人，故宫博物院文物保护科技研究馆员，故宫博物院学术委员会委员，曾任中国科学技术协会第四、六、七届全国委员会委员，中国文物保护技术协会理事长，中国档案学会理事，中国科协工程联执行委员，北京大学、西北大学等校兼职教授，南京博物院、中国甲午战争博物馆等单位文物保护技术顾问，敦煌研究院和秦始皇兵马俑博物馆等国家文物局科研基地学术委员会委员，《文物保护与考古科学》期刊编委，国家文物局科技专家组成员。,https://baike.baidu.com/item/%E9%99%86%E5%AF%BF%E9%BA%9F/1839965
1,丰实,丰实，读音为fēng shí，汉语词语，意思是丰裕殷实；犹充实。,https://baike.baidu.com/item/%E4%B8%B0%E5%AE%9E/2036102
1,黄克忠,,https://baike.baidu.com//item/%E9%BB%84%E5%85%8B%E5%BF%A0/19784454
1,铁付,,https://baike.baidu.com//item/%E4%BB%98%E9%93%81/53452630
1,李化元,,https://baike.baidu.com//item/%E6%9D%8E%E5%8C%96%E5%85%83/23185898
1,研究所,研究所是指以科学研究为主要目的的社会企事业机构。在中国是一种完成为特殊科研目的和任务而建立的研究机构。随着社会的发展，现多以企业形式存在。在学术界，称其为科学试验的研究部门。研究所一直是国家重点扶持和照顾的对象，特别是军工类的研究所，比如航天两大集团，中电集团，航空，中船等重点研究所，一直是很多名校毕业生就业的首选。,https://baike.baidu.com/item/%E7%A0%94%E7%A9%B6%E6%89%80/1884021
1,袁晓东,男，1973年10月生于湖北襄樊。华中科技大学管理知识产权系副教授，博士生副导师。1996年6月毕业于中南政法学院法律系，获法学学士学位。1999年6月毕业于中南政法学院研究生部，获民商法硕士学位。2003年12月毕业于华中科技大学管理学院，获管理学博士学位。先后在《European Intellectual Property Review》、《研究与发展管理》、《民商法论丛》、《法学》、《当代法学》、《知识产权》、《政治与法律》等核心期刊发表论文30余篇。主要研究方向为：知识产权法律运营管理：知识产权证券化、专利经营、法治与权治,https://baike.baidu.com/item/%E8%A2%81%E6%99%93%E4%B8%9C/5784813
1,辽宁大学,辽宁大学（Liaoning University），简称“辽大”，是国家“世界一流学科建设高校”、国家“211工程”重点建设大学、辽宁省一流大学重点建设高校，入选卓越法律人才教育培养计划、国家建设高水平大学公派研究生项目、国家级大学生创新创业训练计划、全国深化创新创业教育改革示范高校、国家大学生文化素质教育基地。辽宁大学源起于1948年11月东北人民政府在沈阳建立的商业专门学校，是中国共产党创建的第一所专门商科高校。1953年，东北商业专科学校合入东北财经学院。1958年，东北财经学院、沈阳师范学院的部分科系与沈阳俄文专科学校合并，组建成辽宁大学，朱德同志亲笔题写了校名。截至2020年6月，辽宁大学有沈阳崇山、沈阳蒲河区，辽阳武圣等3个校区，占地面积2190亩，校舍建筑面积89.44万平方米；有全日制在校学生2.4万余人，其中本科生1.7万人，研究生7100余人；有各类留学生1800余人。,https://baike.baidu.com/item/%E8%BE%BD%E5%AE%81%E5%A4%A7%E5%AD%A6/126264
1,高工,研究员级高工，即研究员级高级工程师。 高级工程师是中国专业技术职称工程类中的高级职称（职称改革后称为专业技术职务任职资格），也是工程师任职资格职称里的最高职称，而研究员级高级工程师、教授级高级工程师是高级工程师任职资格职称里的最高级别之一。,https://baike.baidu.com/item/%E7%A0%94%E7%A9%B6%E5%91%98%E7%BA%A7%E9%AB%98%E5%B7%A5/6147680
1,中国工程物理研究院,中国工程物理研究院（China Academy of Engineering Physics），简称 “中物院” ，是国家科研计划单列的中国唯一的核武器研制生产单位，是以发展国防尖端科学技术为主的集理论、实验、设计、生产为一体的综合性研究院。中物院成立于1958年的北京第九研究所，1964年更名为二机部第九研究设计院，1968年被授予军队番号中国人民解放军第九研究院，1973年使用第二机械工业部第九研究院名称，1982年更名为核工业部第九研究院，1985年对外使用中国工程物理研究院。中物院的研究领域包括物理学、力学与数学、化学与材料、信息科学与电子工程等方面。据2017年1月研究院官网显示，中物院共有在职员工约23000人，其中专业技术人员近10000人，技能人员近9000人，拥有中国科学院院士14人、中国工程院院士14人；截至2012年4月，研究院拥有12个研究所，2个新型科研中心，100余个科研室和30多个生产车间，有7个国防科技重点实验室。截至2016年9月，中物院开设4个博士后科研流动站、5个一级学科博士点、17个二级学科博士点、25个二级学科硕士点。,https://baike.baidu.com/item/%E4%B8%AD%E5%9B%BD%E5%B7%A5%E7%A8%8B%E7%89%A9%E7%90%86%E7%A0%94%E7%A9%B6%E9%99%A2/3565124
1,教授级,教授级高工，即教授级高级工程师。 高级工程师是中国专业技术职称工程类中的高级职称（职称改革后称为专业技术职务任职资格），也是工程师任职资格职称里的最高职称，而教授级高级工程师是高级工程师任职资格职称里的最高级别之一。,https://baike.baidu.com/item/%E6%95%99%E6%8E%88%E7%BA%A7%E9%AB%98%E7%BA%A7%E5%B7%A5%E7%A8%8B%E5%B8%88/6642240
1,研究院,研究院，在学术界，称其为科学试验的研究机构。是大学之后的进阶教育研究机构，一般设于大学中，以“某大学某研究生院”的形式存在，也有独立设立者。研究院与研究生院是两个不同的概念，但港澳地区一般将“研究生院”称为“研究院”。,https://baike.baidu.com/item/%E7%A0%94%E7%A9%B6%E9%99%A2/5365502
1,学院,学院（英文名：College、Institute或Academy）主要指门类科目较少、专业性强的高等教育机构。学院可以作为独立的学校，同时很多大学也拥有自己下属的二级学院（与系相同）或普通高等学校与国家机构以外的社会组织或者个人合作设置的独立学院。截至2020年6月30日，全国高等学校共计3005所，其中：普通高等学校2740所，含本科院校1258所、高职（专科）院校1482所；成人高等学校265所。本名单未包含港澳台地区高等学校。,https://baike.baidu.com/item/%E5%AD%A6%E9%99%A2/999322
1,文化遗产,文化遗产是历史留给人类的宝贵财富。从存在形态上分为物质文化遗产（有形文化遗产）和非物质文化遗产（无形文化遗产）。文化遗产是具有历史、艺术和科学价值的文物；非物质文化遗产是指各种以非物质形态存在的、与群众生活密切相关且世代相承的传统文化。[1-2]2006年起，每年六月的第二个星期六为中国文化遗产日。2017年10月18日习近平同志在十九大报告中指出，要加强文化遗产保护传承。[3-4],https://baike.baidu.com/item/%E6%96%87%E5%8C%96%E9%81%97%E4%BA%A7/749049
1,历史,历史，简称“史”，指对人类社会过去的事件和活动，以及对这些事件行为有系统的记录、研究和诠释。历史是客观存在的，无论文学家们如何书写历史，历史都以自己的方式存在，不可改变。其含义有三：1.记载和解释作为一系列人类进程历史事件的一门学科；2.沿革，来历；3.过去的事实。历史的问题在于不断发现真的过去，在于用材料说话，让人如何在现实中可能成为可以讨论的问题。历史是延伸的。历史是文化的传承，积累和扩展，是人类文明的轨迹。[1-2],https://baike.baidu.com/item/%E5%8E%86%E5%8F%B2/360
1,中国,中国，以华夏文明为源泉、中华文化为基础，是世界上历史最悠久的国家之一。中国各族人民共同创造了光辉灿烂的文化，具有光荣的革命传统。中国是以汉族为主体民族的多民族国家，通用汉语、汉字，汉族与少数民族统称为“中华民族”，又自称“炎黄子孙”、“龙的传人”。中国是世界四大文明古国之一。距今5800年前后，黄河、长江中下游以及西辽河等区域出现了文明起源迹象；距今5300年前后，中华大地各地区陆续进入了文明阶段；距今3800年前后，中原地区形成了更为成熟的文明形态，并向四方辐射文化影响力；后历经多次民族交融和朝代更迭，直至形成多民族国家的大一统局面。20世纪初辛亥革命后，废除了封建帝制，创立了资产阶级民主共和国。1949年中华人民共和国成立后，在中国大陆建立了人民民主专政的社会主义制度。中国疆域辽阔、民族众多，先秦时期的华夏族在中原地区繁衍生息，到了汉代通过文化交融使汉族正式成型，奠定了中国主体民族的基础。后又通过与周边民族的交融，逐步形成统一多民族国家的局面，而人口也不断攀升，宋代中国人口突破一亿，清代时期人口突破四亿，到2005年中国人口已突破十三亿。中国文化渊远流长、博大精深、绚烂多彩，是东亚文化圈的文化宗主国，在世界文化体系内占有重要地位，由于各地的地理位置、自然条件的差异，人文、经济方面也各有特点。传统文化艺术形式有诗词、戏曲、书法、国画等，而春节、元宵、清明、端午、中秋、重阳等则是中国重要的传统节日。[2-6],https://baike.baidu.com/item/%E4%B8%AD%E5%9B%BD/1122445
1,故宫博物院,北京故宫博物院是一座中国综合性博物馆，建立于1925年10月10日，位于北京故宫紫禁城内，收藏品包括但不限于明朝、清朝两代皇宫及其收藏。北京故宫博物院是中国最大的古代文化艺术博物馆，是第一批全国爱国主义教育示范基地。世界三大宫殿之一。[1-2]北京故宫是第一批全国重点文物保护单位、第一批国家5A级旅游景区、全国未成年人思想道德建设工作先进单位，1987年入选《世界文化遗产名录》。2018年10月，故宫博物院发布首款主题功能游戏和首张古画主题音乐专辑，拉开“智慧故宫”序幕。2019年10月，故宫博物院将推出剧集《故宫如梦》，以创新形式讲述年轻工匠蒯祥参与营建紫禁城的过程。2019年10月，故宫博物院与中国中医科学院签署战略合作协议，双方将共同开展清代宫廷中医药文物的科学研究，揭示其文化内涵，挖掘其科学价值。2019年10月19日，故宫博物院的V故宫获VR/AR创新金奖。2020年1月23日，故宫博物院关于闭馆的公告。自2020年1月25日（正月初一）起闭馆，恢复开放时间另行通知。2020年3月24日，第十一届中国最佳文化旅游大奖榜单发布，北京故宫博物院荣获“年度最佳文化旅游大奖”。根据当前北京市疫情防控形势，故宫博物院自2020年5月1日起有序开放，实行预约、错峰、限流参观。,https://baike.baidu.com/item/%E5%8C%97%E4%BA%AC%E6%95%85%E5%AE%AB%E5%8D%9A%E7%89%A9%E9%99%A2/8663390
1,研究员,根据中华人民共和国人事部职称管理评审制度规定，职称是对技术人员工作能力的表述，是由职称评定委员会评审的。研究员是自然科学研究或社会科学研究系列职称，属于正高级职称。研究员职称系列包括实习研究员（初级），助理研究员（中级），副研究员（副高），研究员（正高）。,https://baike.baidu.com/item/%E7%A0%94%E7%A9%B6%E5%91%98/8703381
1,建筑,指人工建筑而成的资产，属于固定资产范畴，包括房屋和构建物两大类。房屋是指供人居住、工作、学习、生产、经营、娱乐、储藏物品以及进行其他社会活动的工程建筑。与建筑物有区别的是构筑物，构建物指房屋以外的工程建筑，如围墙、道路、水坝、水井、隧道、水塔、桥梁和烟囱等。,https://baike.baidu.com/item/%E5%BB%BA%E7%AD%91/405099
