page_id,keyword,annotation,url
2,研究,研究，读音，汉语词语，意思是主动寻求根本性原因与更高可靠性依据，从而为提高事业或功利的可靠性和稳健性而做的工作。,https://baike.baidu.com/item/%E7%A0%94%E7%A9%B6/1883844
4,机制,机制，是指各要素之间的结构关系和运行方式。指有机体的构造、功能及其相互关系；机器的构造和工作原理。语出清 丘逢甲 《汕头海关歌寄伯瑶》：“西人嗜糖嗜其白，贱买赤砂改机制。”在社会学中的内涵可以表述为“在正视事物各个部分的存在的前提下，协调各个部分之间关系以更好地发挥作用的具体运行方式。”,https://baike.baidu.com/item/%E6%9C%BA%E5%88%B6/1433787
4,机器,机器是由各种金属和非金属部件组装成的装置，消耗能源，可以运转、做功。它是用来代替人的劳动、进行能量变换、信息处理、以及产生有用功。机器贯穿在人类历史的全过程中。但是近代真正意义上的“机器”，却是在西方工业革命后才逐步被发明出来。,https://baike.baidu.com/item/%E6%9C%BA%E5%99%A8/2275865
4,阐明,阐明是一个汉语词语，读音chǎn míng，是指讲明白（道理或事件）。,https://baike.baidu.com/item/%E9%98%90%E6%98%8E/7833172
4,调控,调控是一个汉语词语，读音tiáo kòng，调节、控制的意思。另有一个意思，读音diao kòng，调度、控制的意思。,https://baike.baidu.com/item/%E8%B0%83%E6%8E%A7/207531
4,神经元,即神经细胞，是神经系统最基本的结构和功能单位。分为细胞体和突起两部分。细胞体由细胞核、细胞膜、细胞质组成，具有联络和整合输入信息并传出信息的作用。突起有树突和轴突两种。树突短而分枝多，直接由细胞体扩张突出，形成树枝状，其作用是接受其他神经元轴突传来的冲动并传给细胞体。轴突长而分枝少，为粗细均匀的细长突起，常起于轴丘，其作用是接受外来刺激，再由细胞体传出。轴突除分出侧枝外，其末端形成树枝样的神经末梢。末梢分布于某些组织器官内，形成各种神经末梢装置。感觉神经末梢形成各种感受器；运动神经末梢分布于骨骼肌肉，形成运动终极。,https://baike.baidu.com/item/%E7%A5%9E%E7%BB%8F%E5%85%83/674777
3,机制,机制，是指各要素之间的结构关系和运行方式。指有机体的构造、功能及其相互关系；机器的构造和工作原理。语出清 丘逢甲 《汕头海关歌寄伯瑶》：“西人嗜糖嗜其白，贱买赤砂改机制。”在社会学中的内涵可以表述为“在正视事物各个部分的存在的前提下，协调各个部分之间关系以更好地发挥作用的具体运行方式。”,https://baike.baidu.com/item/%E6%9C%BA%E5%88%B6/1433787
4,新型,新型，指新的类型；新式。语出指丁玲 《韦护》第一章一：“她们都是新型的女性。”,https://baike.baidu.com/item/%E6%96%B0%E5%9E%8B/967971
3,蛋白质,蛋白质是组成人体一切细胞、组织的重要成分。机体所有重要的组成部分都需要有蛋白质的参与。一般说，蛋白质约占人体全部质量的18%，最重要的还是其与生命现象有关。蛋白质（protein）是生命的物质基础，是有机大分子，是构成细胞的基本有机物，是生命活动的主要承担者。没有蛋白质就没有生命。氨基酸是蛋白质的基本组成单位。它是与生命及与各种形式的生命活动紧密联系在一起的物质。机体中的每一个细胞和所有重要组成部分都有蛋白质参与。蛋白质占人体重量的16%~20%，即一个60kg重的成年人其体内约有蛋白质9.6~12kg。人体内蛋白质的种类很多，性质、功能各异，但都是由20种氨基酸（Amino acid）按不同比例组合而成的，并在体内不断进行代谢与更新。,https://baike.baidu.com/item/%E8%9B%8B%E7%99%BD%E8%B4%A8/309120
3,表观,表观是一个汉语词语，拼音是biǎo guān，意思是表面的样子、性格或性质。,https://baike.baidu.com/item/%E8%A1%A8%E8%A7%82/10797724
2,蛋白质,蛋白质是组成人体一切细胞、组织的重要成分。机体所有重要的组成部分都需要有蛋白质的参与。一般说，蛋白质约占人体全部质量的18%，最重要的还是其与生命现象有关。蛋白质（protein）是生命的物质基础，是有机大分子，是构成细胞的基本有机物，是生命活动的主要承担者。没有蛋白质就没有生命。氨基酸是蛋白质的基本组成单位。它是与生命及与各种形式的生命活动紧密联系在一起的物质。机体中的每一个细胞和所有重要组成部分都有蛋白质参与。蛋白质占人体重量的16%~20%，即一个60kg重的成年人其体内约有蛋白质9.6~12kg。人体内蛋白质的种类很多，性质、功能各异，但都是由20种氨基酸（Amino acid）按不同比例组合而成的，并在体内不断进行代谢与更新。,https://baike.baidu.com/item/%E8%9B%8B%E7%99%BD%E8%B4%A8/309120
2,调控,调控是一个汉语词语，读音tiáo kòng，调节、控制的意思。另有一个意思，读音diao kòng，调度、控制的意思。,https://baike.baidu.com/item/%E8%B0%83%E6%8E%A7/207531
2,组装,组装是一个汉语词语，意思是组合在一起然后再安装到一部机器上。在计算机领域， 组装分为电脑组装和机械组装。,https://baike.baidu.com/item/%E7%BB%84%E8%A3%85/10840733
3,肠道,肠道是人体重要的消化器官。肠指的是从胃幽门至肛门的消化管，是消化管中最长的一段，也是功能最重要的一段。哺乳动物的肠包括小肠、大肠和直肠3大段。大量的消化作用和几乎全部消化产物的吸收都是在小肠内进行的，大肠主要浓缩食物残渣，形成粪便，再通过直肠经肛门排出体外。,https://baike.baidu.com/item/%E8%82%A0%E9%81%93/6912371
2,机器,机器人（Robot）是一种能够半自主或全自主工作的智能机器。历史上最早的机器人见于隋炀帝命工匠按照柳抃形象所营造的木偶机器人，施有机关，有坐、起、拜、伏等能力。机器人具有感知、决策、执行等基本特征，可以辅助甚至替代人类完成危险、繁重、复杂的工作，提高工作效率与质量，服务人类生活，扩大或延伸人的活动及能力范围。,https://baike.baidu.com/item/%E6%9C%BA%E5%99%A8%E4%BA%BA/888
1,研究,研究，读音，汉语词语，意思是主动寻求根本性原因与更高可靠性依据，从而为提高事业或功利的可靠性和稳健性而做的工作。,https://baike.baidu.com/item/%E7%A0%94%E7%A9%B6/1883844
3,机器,机器人（Robot）是一种能够半自主或全自主工作的智能机器。历史上最早的机器人见于隋炀帝命工匠按照柳抃形象所营造的木偶机器人，施有机关，有坐、起、拜、伏等能力。机器人具有感知、决策、执行等基本特征，可以辅助甚至替代人类完成危险、繁重、复杂的工作，提高工作效率与质量，服务人类生活，扩大或延伸人的活动及能力范围。,https://baike.baidu.com/item/%E6%9C%BA%E5%99%A8%E4%BA%BA/888
1,蛋白质,蛋白质是组成人体一切细胞、组织的重要成分。机体所有重要的组成部分都需要有蛋白质的参与。一般说，蛋白质约占人体全部质量的18%，最重要的还是其与生命现象有关。蛋白质（protein）是生命的物质基础，是有机大分子，是构成细胞的基本有机物，是生命活动的主要承担者。没有蛋白质就没有生命。氨基酸是蛋白质的基本组成单位。它是与生命及与各种形式的生命活动紧密联系在一起的物质。机体中的每一个细胞和所有重要组成部分都有蛋白质参与。蛋白质占人体重量的16%~20%，即一个60kg重的成年人其体内约有蛋白质9.6~12kg。人体内蛋白质的种类很多，性质、功能各异，但都是由20种氨基酸（Amino acid）按不同比例组合而成的，并在体内不断进行代谢与更新。,https://baike.baidu.com/item/%E8%9B%8B%E7%99%BD%E8%B4%A8/309120
1,专项,特定的某个项目。例句：～训练。进行～检查。～资金。[1-2],https://baike.baidu.com/item/%E4%B8%93%E9%A1%B9/10927791
1,国拨,,https://baike.baidu.com//item/%E5%9B%BD%E6%8B%A8%E6%9D%90%E6%96%99%E3%80%81%E9%83%A8%E7%AE%A1%E6%9D%90%E6%96%99
1,支持,支持，汉语词语，拼音是zhī chí，意思是支撑，供应，赞同鼓励。,https://baike.baidu.com/item/%E6%94%AF%E6%8C%81/676624
2,相变,物质从一种相转变为另一种相的过程。物质系统中物理、化学性质完全相同，与其他部分具有明显分界面的均匀部分称为相。与固、液、气三态对应，物质有固相、液相、气相。,https://baike.baidu.com/item/%E7%9B%B8%E5%8F%98/5936757
