page_id,keyword,annotation,url
3,不超,省长讲话不超过1小时事件是指广东省政府官网公布的关于以部门名义召开的会议各部门每年不超过1个的规定。,https://baike.baidu.com/item/%E7%9C%81%E9%95%BF%E8%AE%B2%E8%AF%9D%E4%B8%8D%E8%B6%85%E8%BF%871%E5%B0%8F%E6%97%B6%E4%BA%8B%E4%BB%B6/12709911
3,项目,项目是人们通过努力，运用新的方法，将人力的、材料的和财务的资源组织起来，在给定的费用和时间约束规范内，完成一项独立的、一次性的工作任务，以期达到由数量和质量指标所限定的目标。叶圣陶《倪焕之》二五：“教育这个项目当然是不容轻易忽略的。” 洪深 《戏剧导演的初步知识》上篇二：“它们的式样、大小、制造的材料、使用的方法等等，项目繁多。” 秦牧 《艺海拾贝·核心》：“生动的语言和丰富的词汇，看来该是技巧性很强的一个项目了。”项目参数包括项目范围、质量、成本、时间、资源。美国项目管理协会（project Management Institute，PMI)在其出版的《项目管理知识体系指南》（Project Management Body of Knowledge，PMBOK）中为项目所做的定义是：项目是为创造独特的产品、服务或成果而进行的临时性工作。以下活动都可以称为一个项目：1、开发一项新产品；2、计划举行一项大型活动（如策划组织婚礼、大型国际会议等）；3、策划一次自驾游旅游；4、ERP的咨询、开发、实施与培训。,https://baike.baidu.com/item/%E9%A1%B9%E7%9B%AE/477803
3,内多学,,https://baike.baidu.com/item/内多学

3,申报,《申报》原名《申江新报》，1872年4月30日（清同治十一年三月二十三日）在上海创刊，1949年5月27日停刊。是近代中国发行时间最久、具有广泛社会影响的报纸，是中国现代报纸开端的标志。它前后总计经营了77年，历经晚清、北洋政府、国民政府三个时代，共出版27000余期，出版时间之长，影响之广泛，同时期其它报纸难以企及，在中国新闻史和社会史研究上都占有重要地位，被人称为研究中国近现代史的“百科全书”。,https://baike.baidu.com/item/%E7%94%B3%E6%8A%A5/3577852
2,因子,因子，基本含义为“元素、因素、成分”，出自孙中山《实业计划》：“一切人类智识，以印刷蓄积之，故此为文明一大因子。”,https://baike.baidu.com/item/%E5%9B%A0%E5%AD%90/10876777
3,项目数,,https://baike.baidu.com//item/%E9%A1%B9%E7%9B%AE%E5%8F%82%E6%95%B0
2,溯源,溯源是一个汉语词汇，拼音为sùyuán，指的是往上游寻找发源的地方，比喻向上寻求历史根源。溯源最早也是1997年欧盟为应对“疯牛病”问题而逐步建立并完善起来的食品安全管理制度。技术应用:物联网技术、自动控制技术、自动识别技术、互联网技术、云存储技术、区块链技术及云传输技术。实际操作：通过专业的机器设备对单件产品赋予唯一的二维码作为防伪身份证，实现“每个产品都有自己的身份编码”，然后可对产品的生产、仓储、分销、物流运输、市场稽查、销售终端等各个环节采集数据并追踪，构成产品的生产、仓储、销售、流通和服务的一个全生命周期管理。,https://baike.baidu.com/item/%E6%BA%AF%E6%BA%90/400849
2,土壤,土壤是指地球表面的一层疏松的物质，由各种颗粒状矿物质、有机物质、水分、空气、微生物等组成，能生长植物。土壤由岩石风化而成的矿物质、动植物、微生物残体腐解产生的有机质、土壤生物（固相物质）以及水分（液相物质）、空气（气相物质）、氧化的腐殖质等组成。固体物质包括土壤矿物质、有机质和微生物通过光照抑菌灭菌后得到的养料等。液体物质主要指土壤水分。气体是存在于土壤孔隙中的空气。土壤中这三类物质构成了一个矛盾的统一体。它们互相联系，互相制约，为作物提供必需的生活条件，是土壤肥力的物质基础。,https://baike.baidu.com/item/%E5%9C%9F%E5%A3%A4/33675
3,单位,单位，指机关、团体或属于一个机关、团体的各个部门；指数学方面或物理方面计量事物的标准量的名称。一般有：米（m）、千米（km）、牛（顿） N、帕（斯卡）Pa等单位；在佛教传统意义上讲单位，特指长度、质量、时间等的定量单位，也有专门的术语如：刹那、一瞬、弹指、须臾等。准确的说，单位就是将一定数量物质的集合规定为“1” ，成为一个单位。从广义上讲：单位是一个相对概念，其为事物坐标系中的坐标轴中能构成个体的抽象概念。事物的最小单位为零。,https://baike.baidu.com/item/%E5%8D%95%E4%BD%8D/32292
3,课题,所谓课题，指要研究、解决的问题，所以课题背景就是指该问题是在什么情况或条件下产生的，课题研究有什么意义，等等。课题包括：市级课题、省级课题、国家级课题等。,https://baike.baidu.com/item/%E8%AF%BE%E9%A2%98/2434814
2,药材,药材即可供制药的原材料，在中国尤指是中药材，即未经加工或未制成成品的中药原料。中药是中国传统的药材，中国药文化源远流长、博大精深，既包含数千年中药文明又融合近现代西药文明所创造的中西药并举、独具特色的文化现象，是中国优秀文化的重要组成部分。,https://baike.baidu.com/item/%E8%8D%AF%E6%9D%90/7493145
1,中药,以中国传统医药理论指导采集、炮制、制剂，说明作用机理，指导临床应用的药物，统称为中药。简而言之，中药就是指在中医理论指导下，用于预防、治疗、诊断疾病并具有康复与保健作用的物质。中药主要来源于天然药及其加工品，包括植物药、动物药、矿物药及部分化学、生物制品类药物。由于中药以植物药居多，故有“诸药以草为本”的说法。,https://baike.baidu.com/item/%E4%B8%AD%E8%8D%AF/295975
1,中医,中医一般指以中国汉族劳动人民创造的传统医学为主的医学，所以也称汉医。是研究人体生理、病理以及疾病的诊断和防治等的一门学科。中医诞生于原始社会，春秋战国时期中医理论已基本形成，之后历代均有总结发展。除此之外对汉字文化圈国家影响深远，如日本医学、韩国韩医学、朝鲜高丽医学、越南东医学等都是以中医为基础发展起来的。中医承载着中国古代人民同疾病作斗争的经验和理论知识，是在古代朴素的唯物论和自发的辩证法思想指导下，通过长期医疗实践逐步形成并发展成的医学理论体系。中医学以阴阳五行作为理论基础，将人体看成是气、形、神的统一体，通过“望闻问切”四诊合参的方法，探求病因、病性、病位，分析病机及人体内五脏六腑、经络关节、气血津液的变化，判断邪正消长，进而得出病名，归纳出证型，以辨证论治原则，制定“汗、吐、下、和、温、清、补、消”等治法，使用中药、针灸、推拿、按摩、拔罐、气功、食疗等多种治疗手段，使人体达到阴阳调和而康复。2018年10月1日，世界卫生组织首次将中医纳入其具有全球影响力的医学纲要。,https://baike.baidu.com/item/%E4%B8%AD%E5%8C%BB/234039
1,专项,特定的某个项目。例句：～训练。进行～检查。～资金。[1-2],https://baike.baidu.com/item/%E4%B8%93%E9%A1%B9/10927791
1,中药材,中药材就有道地性的说法，它是指人们传统公认的且来源于特定产区的具有中国特色的名优正品药材，其本质是药材质量好、疗效好，在长期使用中得到了医者与患者的普遍认可。然而，中药材道地性的划分标准主要来源于实践经验，是人为的、相对的、模糊的，许多道地药材质量形成的科学机理尚不清楚，只知其然不知其所以然，特别是在道地产区内同种药材的质量也参差不齐。中药材指在汉族传统医术指导下应用的原生药材，用于治疗疾病。一般传统中药材讲究地道药材，是指在一特定自然条件、生态环境的地域内所产的药材，因生产较为集中，栽培技术、采收 加工也都有一定的讲究，以致较同种药材在其他地区所产者品质佳、疗效好。,https://baike.baidu.com/item/%E4%B8%AD%E8%8D%AF%E6%9D%90/15524
2,特征,特征，汉语词语，读音为tè zhēng，意思是一事物异于其他事物的特点。,https://baike.baidu.com/item/%E7%89%B9%E5%BE%81/6205236
1,中医药,中医药，是包括汉族和少数民族医药在内的我国各民族医药的统称，反映了中华民族对生命、健康和疾病的认识，具有悠久历史传统和独特理论及技术方法的医药学体系。2020年3月27日，根据中华人民共和国国务院令第726号，对“中华人民共和国中医药条例（2003年4月7日中华人民共和国国务院令第374号公布）”予以废止。,https://baike.baidu.com/item/%E4%B8%AD%E5%8C%BB%E8%8D%AF/1584465
2,品质,品质，是一个汉语词语，指人的行为和作风所显示的思想、品性、认识等实质，东西的质量。,https://baike.baidu.com/item/%E5%93%81%E8%B4%A8/82672
1,传承,传承是一个汉语词语，读音为chuán chéng。泛指对某某学问、技艺、教义等，在师徒间的传授和继承的过程。泛指对前人的经验进行传授和继承并发扬发展的过程。,https://baike.baidu.com/item/%E4%BC%A0%E6%89%BF/81910
