page_id,keyword,annotation,url
1,北京航空航天大学,北京航空航天大学（Beihang University）简称北航，是中华人民共和国工业和信息化部直属的全国重点大学，位列世界一流大学建设高校、211工程和985工程重点建设高校，入选珠峰计划、2011计划、111计划、卓越工程师教育培养计划、中国政府奖学金来华留学生接收院校、国家建设高水平大学公派研究生项目、国家级新工科研究与实践项目、国家级大学生创新创业训练计划、国家大学生创新性实验计划、全国深化创新创业教育改革示范高校、强基计划试点高校，为国际宇航联合会、中欧精英大学联盟、中国-西班牙大学联盟、中俄工科大学联盟、中国高校行星科学联盟、中国人工智能教育联席会成员。北京航空航天大学创建于1952年，时名北京航空学院，由当时的清华大学、北洋大学、厦门大学、四川大学等八所院校的航空系合并组建，1959年学校被国家指定为全国重点高校，1988年4月改名为北京航空航天大学。[1-2]截至2020年8月，学校学院路、沙河校区总占地共3000多亩，总建筑面积170余万平方米；学校下有35个二级学院；有23个博士后科研流动站，25个博士学位授权一级学科点，39个硕士学位授权一级学科点，74个本科专业；有8个一级学科国家重点学科，28个二级学科国家重点学科；有教职工4266人，有全日制在校生37000余人。,https://baike.baidu.com/item/%E5%8C%97%E4%BA%AC%E8%88%AA%E7%A9%BA%E8%88%AA%E5%A4%A9%E5%A4%A7%E5%AD%A6/133845
1,王立天,,https://baike.baidu.com//item/%E7%8E%8B%E7%AB%8B%E5%A4%A9
1,王启铭,,https://baike.baidu.com//item/%E7%8E%8B%E5%90%AF%E9%93%AD
1,于跃斌,,https://baike.baidu.com//item/%E4%BA%8E%E8%B7%83%E6%96%8C
1,梁建英,,https://baike.baidu.com//item/%E6%A2%81%E5%BB%BA%E8%8B%B1/20865084
1,研究院,研究院，在学术界，称其为科学试验的研究机构。是大学之后的进阶教育研究机构，一般设于大学中，以“某大学某研究生院”的形式存在，也有独立设立者。研究院与研究生院是两个不同的概念，但港澳地区一般将“研究生院”称为“研究院”。,https://baike.baidu.com/item/%E7%A0%94%E7%A9%B6%E9%99%A2/5365502
1,轨道交通,轨道交通是指运营车辆需要在特定轨道上行驶的一类交通工具或运输系统。最典型的轨道交通就是由传统火车和标准铁路所组成的铁路系统。随着火车和铁路技术的多元化发展，轨道交通呈现出越来越多的类型，不仅遍布于长距离的陆地运输，也广泛运用于中短距离的城市公共交通中。常见的轨道交通有传统铁路（国家铁路、城际铁路和市域铁路）、地铁、轻轨和有轨电车，新型轨道交通有磁悬浮轨道系统、单轨系统（跨座式轨道系统和悬挂式轨道系统）和旅客自动捷运系统等。在中国国家标准《城市公共交通常用名词术语》中，将城市轨道交通定义为“通常以电能为动力，采取轮轨运转方式的快速大运量公共交通的总称。”根据服务范围差异，轨道交通一般分成国家铁路系统、城际轨道交通和城市轨道交通三大类。轨道交通普遍具有运量大、速度快、班次密、安全舒适、准点率高、全天候、运费低和节能环保等优点，但同时常伴随着较高的前期投资、技术要求和维护成本，并且占用的空间往往较大。,https://baike.baidu.com/item/%E8%BD%A8%E9%81%93%E4%BA%A4%E9%80%9A/1141093
1,有限责任,有限责任是“无限责任”的对称。指债务人以法律规定的财产范围对某种债务承担责任。有限责任可分为人的有限责任和物的有限责任。前者指债务人仅以一定的最高财产额为承担责任的限度。如股份有限公司的股东，对公司破产后所负的一切债务，仅以其入股的数额为限承担责任; 后者指债务人仅以特定的财产为负担责任的限度。如继承人对于被继承人的债务所负担的责任，仅以所继承的财产为限。,https://baike.baidu.com/item/%E6%9C%89%E9%99%90%E8%B4%A3%E4%BB%BB/8922294
1,荣军,荣军，男，汉族，1972年7月出生，1992年7月参加工作，1999年3月加入中国共产党，大学学历。现任黑龙江省齐齐哈尔市拜泉县委副书记、县长。,https://baike.baidu.com/item/%E8%8D%A3%E5%86%9B/10718177
1,研究员,根据中华人民共和国人事部职称管理评审制度规定，职称是对技术人员工作能力的表述，是由职称评定委员会评审的。研究员是自然科学研究或社会科学研究系列职称，属于正高级职称。研究员职称系列包括实习研究员（初级），助理研究员（中级），副研究员（副高），研究员（正高）。,https://baike.baidu.com/item/%E7%A0%94%E7%A9%B6%E5%91%98/8703381
1,中科院,中国科学院（英文名称：Chinese Academy of Sciences，简称中科院）成立于1949年11月，为中国自然科学最高学术机构、科学技术最高咨询机构、自然科学与高技术综合研究发展中心。中国科学院提出了建设国家创新体系的构想，先后实施知识创新工程、“创新2020”、《“率先行动”计划暨全面深化改革纲要》，提出了《迎接知识经济时代，建设国家创新体系》、《创新促进发展，科技引领未来》、《创新2050：科学技术与中国的未来》、《科技发展新态势与面向2020年的战略选择》等战略研究报告。据2018年11月中国科学院官网显示，全院共拥有12个分院、100多家科研院所、3所大学（中国科学院大学、中国科学技术大学，与上海市共建上海科技大学）、130多个国家级重点实验室和工程中心、210多个野外观测台站，承担20余项国家重大科技基础设施的建设与运行，正式职工7.1万余人，在学研究生6.4万余人；建成了完整的自然科学学科体系，物理、化学、材料科学、数学、环境与生态学、地球科学等学科整体水平已进入世界先进行列，一些领域方向也具备了进入世界第一方阵的良好态势。在解决关系国家全局和长远发展的重大问题上，已成为不可替代的国家战略科技力量。一批科学家在国家重大科技任务中发挥了关键和中坚作用，并作为我国科技界的代表活跃在国际科技前沿。2019年9月，经党中央批准，十九届中央第四轮巡视将对中国科学院党组织开展常规巡视。,https://baike.baidu.com/item/%E4%B8%AD%E5%9B%BD%E7%A7%91%E5%AD%A6%E9%99%A2/271375
1,研究所,研究所是指以科学研究为主要目的的社会企事业机构。在中国是一种完成为特殊科研目的和任务而建立的研究机构。随着社会的发展，现多以企业形式存在。在学术界，称其为科学试验的研究部门。研究所一直是国家重点扶持和照顾的对象，特别是军工类的研究所，比如航天两大集团，中电集团，航空，中船等重点研究所，一直是很多名校毕业生就业的首选。,https://baike.baidu.com/item/%E7%A0%94%E7%A9%B6%E6%89%80/1884021
1,教授,教授，是一种高等教育体系中的职称。多指在大学或社区学院中执教的资深教师与研究员，但教授与研究员是有区别的。教授有教课的任务，而研究员则没有。教授为大学教师职称的最高级别。中文的教授两字则源于“传教授业”的字义，是中国古代就使用的学官名称，在中国汉代、唐代的大学中都设此职位。这个词语与英文没有关联。日语中则与中文同用“教授”来称呼大学中的老师。,https://baike.baidu.com/item/%E6%95%99%E6%8E%88/18291
1,四方,四方，指各处；天下，泛指地面的四个方向，即：东、南、西、北。也可指正方形。见《礼记·曲礼下》：“天子祭天地，祭四方。”,https://baike.baidu.com/item/%E5%9B%9B%E6%96%B9/35345
1,教授级,教授级高工，即教授级高级工程师。 高级工程师是中国专业技术职称工程类中的高级职称（职称改革后称为专业技术职务任职资格），也是工程师任职资格职称里的最高职称，而教授级高级工程师是高级工程师任职资格职称里的最高级别之一。,https://baike.baidu.com/item/%E6%95%99%E6%8E%88%E7%BA%A7%E9%AB%98%E7%BA%A7%E5%B7%A5%E7%A8%8B%E5%B8%88/6642240
1,高工,研究员级高工，即研究员级高级工程师。 高级工程师是中国专业技术职称工程类中的高级职称（职称改革后称为专业技术职务任职资格），也是工程师任职资格职称里的最高职称，而研究员级高级工程师、教授级高级工程师是高级工程师任职资格职称里的最高级别之一。,https://baike.baidu.com/item/%E7%A0%94%E7%A9%B6%E5%91%98%E7%BA%A7%E9%AB%98%E5%B7%A5/6147680
1,大学,《大学》是一篇论述儒家修身齐家治国平天下思想的散文，原是《小戴礼记》第四十二篇，相传为春秋战国时期曾子所作，实为秦汉时儒家作品，是一部中国古代讨论教育理论的重要著作。经北宋程颢、程颐竭力尊崇，南宋朱熹又作《大学章句》，最终和《中庸》《论语》《孟子》并称“四书”。宋、元以后，《大学》成为学校官定的教科书和科举考试的必读书，对中国古代教育产生了极大的影响。《大学》提出的“三纲领”（明明德、亲民、止于至善）和“八条目”（格物、致知、诚意、正心、修身、齐家、治国、平天下），强调修己是治人的前提，修己的目的是为了治国平天下，说明治国平天下和个人道德修养的一致性。《大学》全文文辞简约，内涵深刻，影响深远，主要概括总结了先秦儒家道德修养理论，以及关于道德修养的基本原则和方法，对儒家政治哲学也有系统的论述，对做人、处事、治国等有深刻的启迪性。,https://baike.baidu.com/item/%E5%A4%A7%E5%AD%A6/5655065
1,交通,交通，指从事旅客和货物运输及语言和图文传递的行业，包括运输和邮电两个方面，在国民经济中属于第三产业。运输有铁路、公路、水路、空路、管道五种方式，邮电包括邮政和电信两方面内容。“交通”一词的概念，最早可追溯至《易经》“天地交而万物通”之概念。,https://baike.baidu.com/item/%E4%BA%A4%E9%80%9A/30183
1,有限公司,有限责任公司，简称有限公司，中国的有限责任公司是指根据《中华人民共和国公司登记管理条例》规定登记注册，由五十个以下的股东出资设立，每个股东以其所认缴的出资额为限对公司承担有限责任，公司法人以其全部资产对公司债务承担全部责任的经济组织。有限责任公司包括国有独资公司以及其他有限责任公司。我国法定公司有两种形式：有限责任公司(co.,ltd或ltd.）和股份有限公司（co.,ltd.）,https://baike.baidu.com/item/%E6%9C%89%E9%99%90%E8%B4%A3%E4%BB%BB%E5%85%AC%E5%8F%B8/575825
1,中车,,https://baike.baidu.com//item/%E4%B8%AD%E5%9B%BD%E4%B8%AD%E8%BD%A6%E9%9B%86%E5%9B%A2%E6%9C%89%E9%99%90%E5%85%AC%E5%8F%B8
